index,category,title,question,group,url,contact,answer
0,транспортування,Кампус паркінг,"Отже, якщо мені потрібно доїхати до Academia Sinica, як мені туди дістатися?",життя,https://dga.sinica.edu.tw/posts/167917,02-2789-9432,"Ой-ай! Якщо я хочу проїхати до Academia Sinica, я повинен спочатку перейти на веб-сайт Управління загальних справ, щоб завантажити форму заявки на дозвіл на паркування. Після її заповнення я зв’яжусь із вікном підрозділу для затвердження печатки, а потім надішлю її до Загальних справ Офіс подачі заяв.Після погодження мені буде окремо повідомлено про отримання паркувального талону та сплату збору. Якщо я забуду взяти свій талон на паркування, мені доведеться заплатити мито в розмірі 200 NT$, перш ніж я зможу потрапити на територію кампусу. Якщо я користуюся простроченою карткою, мені доведеться чекати наступного дня після закінчення терміну дії"
1,транспортування,Кампус паркінг,"О, мені сьогодні потрібно йти на роботу в Academia Sinica, але я ще не заплатив внески, що мені робити?",життя,https://dga.sinica.edu.tw/posts/167917,02-2789-9432,"О, гаразд! Якщо ви не заплатили за паркування, не хвилюйтеся! Просто перейдіть на веб-сайт Управління із загальних справ, щоб завантажити форму заявки на дозвіл на паркування, заповніть її та зв’яжіться з вікном підрозділу для затвердження печатки, а потім надішліть її до Управління з загальних питань для подання. Після затвердження ви отримаєте сповіщення про отримання дозвіл на паркування та сплатити збір. Якщо у вас виникла надзвичайна ситуація, ви можете повідомити про це безпосередньо до поліцейської дільниці чи поліцейської дільниці, і вони розглядатимуть випадок у кожному конкретному випадку.

О, я їхав в Academia Sinica на роботу вранці, але я забув заплатити."
2,транспортування,Кампус паркінг,"Я хочу сьогодні піти до лікаря в Academia Sinica, але в мене немає перепустки на машину. Що мені робити?",життя,https://dga.sinica.edu.tw/posts/167917,02-2789-9432,"Будь ласка, перейдіть на веб-сайт Управління загальних справ, щоб завантажити форму заявки на дозвіл на паркування. Після її заповнення зверніться до вікна підрозділу для затвердження печатки, а потім надішліть її до Управління загальних справ для подання. Після затвердження ви отримаєте сповіщення про отримання дозвіл на паркування та сплатити збір."
3,транспортування,Кампус паркінг,"Мені сьогодні потрібно їхати в Academia Sinica на зустріч, але мій мотоцикл не припаркований у призначеному місці. Що мені робити?",життя,https://dga.sinica.edu.tw/posts/167917,02-2789-9432,"Будьте певні, я відповім на ваші запитання. Згідно з правилами дорожнього руху та паркування транспортних засобів у кампусі Academia Sinica, мотоциклам заборонено проїжджати в кампусі, окрім випадків, коли вони є службовими транспортними засобами, поліцейськими автомобілями, транспортними засобами для інвалідів або автомобілями екстреної допомоги. Тому паркувати мотоцикли на території лікарні без попередньої заяви та погодження заборонено.

Щоб вирішити цю проблему, рекомендується скористатися громадським транспортом (наприклад, автобусами) до станції біля кампусу Academia Sinica, а потім пішки до воріт кампусу."
4,транспортування,Кампус паркінг,...(Ви можете продовжувати додавати нові запитання та використовувати їх у щоденних ситуаціях,життя,https://dga.sinica.edu.tw/posts/167917,02-2789-9432,"Згідно з наведеним вище описом, якщо ви хочете знати, як подати заяву на дозвіл на паркування та сплатити збір, ви можете завантажити форму заявки на дозвіл на паркування з веб-сайту Управління загальних справ, заповнити її та звернутися до вікна підрозділу для погодження перед надсиланням до Управління загальних справ для подання; якщо ви хочете знати, як боротися з незаконним паркуванням або використанням прострочених перепусток, ви можете впоратися з цим на основі запису нелегальних транспортних засобів і обробки прострочених перепусток; якщо ви хочете знати мотоцикл Правила проїзду та паркування, ви можете дізнатися про методи керування проїздом та паркуванням мотоциклів на території лікарні."
5,транспортування,Інформація про дорожній рух,"о! Отже, всім має бути цікаво, де знаходиться Academia Sinica? Відповідь: No. 128, Section 2, Xueyin Rd., Nangang District, Taipei City! (підозрюваний?)",життя,https://www.sinica.edu.tw/ch/articles/37,02-2789-9827,"о! добре! Academia Sinica розташована за адресою No. 128, Section 2, Academia Sinica Road, Nangang District, Taipei City! (підтвердити)"
6,транспортування,Інформація про дорожній рух,Яку транспортну інформацію має Academia Sinica? (очікувати?),життя,https://www.sinica.edu.tw/ch/articles/37,02-2789-9827,"Згідно з текстом, Academia Sinica розташована за адресою № 128, секція 2, Academia Sinica Road, район Нанганг, місто Тайбей. Щоб отримати інформацію про транспортування, зверніться на веб-сайт Academia Sinica https://www.sinica.edu.tw/ch/articles/37. Тут міститься інформація про розташування Academia Sinica, різноманітна транспортна інформація та короткий огляд кампусу.

Щоб дізнатися про визначні пам'ятки та об'єкти Academia Sinica, зверніться до карти путівника по кампусу https://www.sinica.edu.tw/downloadFile_m.php?file=00"
7,транспортування,Інформація про дорожній рух,"...За інформацією, до Academia Sinica можна дійти пішки від станції метро! (у захваті!)",життя,https://www.sinica.edu.tw/ch/articles/37,02-2789-9827,Гм… гм… гм… гм… гм… гм… гм… гм… гм… гм… гм… гм… гм… гм… гм… гм… гм… гм… гм… гм… гм… …гм…гм…гм…гм…гм…гм…гм…гм…гм…
8,транспортування,Інформація про дорожній рух,Де я можу звернутися до екскурсовода по кампусу Academia Sinica? (З цікавості!),життя,https://www.sinica.edu.tw/ch/articles/37,02-2789-9827,"В ПОРЯДКУ! Згідно з текстовим описом, ви можете звернутися до вступу до навігації в кампусі Academia Sinica: Campus Navigation Map (https://www.sinica.edu.tw/downloadFile_m.php?file=0003p1.pdf&_downloadName=asmap_c_20210813.pdf) ."
9,транспортування,Інформація про дорожній рух,……навіть,життя,https://www.sinica.edu.tw/ch/articles/37,02-2789-9827,"Згідно з наведеним вище описом тексту, відповідаючи на запитання, я буду використовувати тон повсякденного мовлення та уникатиму часток.

З: ...навіть...

Відповідь: Academia Sinica розташована за адресою No. 128, Section 2, Academia Sinica Road, Nangang District, Taipei City."
10,залишитися,Інформація про гуртожиток,Вам цікаво розташування та транспортні можливості гуртожитків для новоспечених студентів? Ви хочете це перевірити?,життя,https://dorm.apps.sinica.edu.tw/,"02-2789-8068
02-2789-8705","Будь ласка, подивіться! Гуртожиток для нещодавно набраних студентів розташований за адресою: No. Художній музей та інші пам'ятки поблизу. З точки зору транспорту, ви можете сісти на метро до станції Nangang або сісти на автобус до станції Nangang Software Park чи станції Nangang Exhibition Hall, обидва вони дуже зручні. Якщо вам потрібна додаткова інформація, ви можете запитати в організаторів кожного центрального гуртожитку."
11,залишитися,Інформація про гуртожиток,"Я чув, що гуртожитки для новоспечених студентів можуть перевести в інші типи гуртожитків. Це правда? Ви можете перевірити відповідні нормативні акти.",життя,https://dorm.apps.sinica.edu.tw/,"02-2789-8068
02-2789-8705","Відповідно до опису, новоспечені студенти можуть орендувати гуртожиток у будь-який час протягом 5 років після прибуття, але однокімнатні та багатокімнатні гуртожитки вони можуть орендувати лише один раз. Тобто ті, хто орендує нове однокімнатне житло, після виселення не можуть взяти в оренду нове однокімнатне, але протягом 5 років після заселення можуть взяти нове багатокімнатне.
Є умови для оренди гуртожитків для новоприйнятих студентів."
12,залишитися,Інформація про гуртожиток,Чому ті новоприйняті однокімнатні гуртожитки не можуть позичити нові однокімнатні гуртожитки після виїзду? Ви можете перевірити відповідні нормативні акти.,життя,https://dorm.apps.sinica.edu.tw/,"02-2789-8068
02-2789-8705","Згідно зі статтею 9 Основних положень управління гуртожитками Academia Sinica, новоприйняті науковці можуть позичати нещодавно прийняті студентські гуртожитки в будь-який час протягом п’яти років після вступу на посаду, але вони можуть позичати однокімнатні та багатокімнатні новонайняті студентські гуртожитки лише один раз кожен . Інакше кажучи, ті, хто орендує нове однокімнатне житло, після виселення не можуть взяти нове однокімнатне житло.

Стаття 5 стандарту плати за гуртожиток Academia Sinica також передбачає, що позичальник повинен сплатити відповідні комісії під час оренди гуртожитку."
13,залишитися,Інформація про гуртожиток,"Я чув, що в гуртожитку немає меблів, техніки та іншої техніки. Це правда? може",життя,https://dorm.apps.sinica.edu.tw/,"02-2789-8068
02-2789-8705","Так, згідно з текстом, новоспечені наукові працівники можуть орендувати гуртожиток новоприйнятих наукових співробітників у будь-який час протягом 5 років після вступу на посаду, але гуртожитки не забезпечуються меблями, технікою та іншим обладнанням. Будь ласка, подайте документи на гуртожиток через офіційні документи, видані організаторами гуртожитків кожного центру."
14,спілкування,Акція субсидії витрат на телефонний зв'язок,"Хм, так ЦНДІ надає субсидії на мобільний зв'язок деяким працівникам. Чи можете ви розповісти мені більше про те, хто має право на цю субсидію? 🤔",життя,https://dga.sinica.edu.tw/posts/78974,02-2789-9730,"Звичайно! Відповідно до наданої інформації, ЦНДІ субсидує витрати на мобільний зв’язок наступним працівникам:

1. Директор та заступник директора Інституту;
2. Відповідальний секретар Вчено-консультативної ради;
3. Директори інститутів, заступники директорів;
4. Директори інститутів, заступники директорів;
5. Начальники інститутів, заступники начальників;
6. Офіцери інституту;
7. Офіс інституту"
15,спілкування,Акція субсидії витрат на телефонний зв'язок,"Субсидія покриває вартість дзвінків, здійснених з дому, чи лише для дзвінків поза офісом? 📞",життя,https://dga.sinica.edu.tw/posts/78974,02-2789-9730,"Згідно з додатковими положеннями щодо оплати послуг мобільного зв’язку, субсидованих Academia Sinica, до одержувачів плати за мобільний зв’язок, яку несе Academia Sinica, входять декан і заступник декана; відповідальний секретар і заступник виконавчого секретаря Вченої консультативної ради; директор і заступник директора інституту Директор; директор і заступник директора Підготовчого відділу Інституту; директор і заступник директора наукового центру; заступники генерального секретаря, керівники різних відділів, управлінь, центральних підрозділів; ексклюзивне водіння для президент, віце-президент і голова округу.

Таким чином, якщо працівник здійснює дзвінок не з дому чи офісу"
16,спілкування,Акція субсидії витрат на телефонний зв'язок,"Якщо працівник закріплений у віддаленій місцевості, чи покриває субсидія вартість здійснених дзвінків",життя,https://dga.sinica.edu.tw/posts/78974,02-2789-9730,"Згідно з додатковим положенням про оформлення витрат на мобільний зв’язок для субсидії Academia Sinica, якщо працівники працюють у віддалених районах, субвенція на витрати на мобільний зв’язок включає декана, заступника декана, відповідального секретаря Вченої консультативної ради, заст. відповідальний секретар, директор НДІ, заступник директора, директор підготовчого кабінету інституту, заступник директора, директор наукового центру, заступник директора, заступник генерального секретаря, завідувачі відділів, управлінь, ЦО, декан, заступник декана та районний начальник та ін.

Тому, якщо працівника відряджено до"
17,Зал хол,дитячий садок,"Добре, ось запитання на основі наданої інформації:",життя,https://kindergarten.sinica.edu.tw/,02-2787-1451,"Добре, виходячи з наданої інформації, мої запитання такі:

1. Скільки класів у приватних дитячих садках у місті Тайбей?
2. Скільки людей у ​​кожному класі?
3. Орієнтовний набір дітей 3-6 років Розраховується виходячи з віку приписки. В якому році вони будуть зараховані?
4. Який веб-сайт https://kindergarten.sinica.edu.tw/?"
18,Зал хол,дитячий садок,"Скільки загалом класів у приватному дитячому садку, що належить Academia Sinica у місті Тайпей?",життя,https://kindergarten.sinica.edu.tw/,02-2787-1451,"Відповідно до опису, у приватних дитячих садках міста Тайбей є 4 класи, по 30 дітей у кожному класі. Таким чином, у приватних дитячих садках міста Тайбей, пов’язаних з Academia Sinica, загалом 120 дітей."
19,Зал хол,дитячий садок,Які вікові групи є в кожному класі?,життя,https://kindergarten.sinica.edu.tw/,02-2787-1451,"Згідно з правилами муніципального дитячого садка Тайбея, вікові групи дітей у кожному класі: малий клас — від 3 років до 4 років; середній клас — від 4 років до 5 років; великий клас — 5 років. років до 6 років; різновіковий клас – від 3 років до 6 років. Тому в кожному класі навчається близько 30 дітей віком від 3 до 6 років."
20,Зал хол,дитячий садок,О котрій годині парк щороку оголошує набір нових студентів?,життя,https://kindergarten.sinica.edu.tw/,02-2787-1451,"Гаразд! Згідно з оголошенням приватного дитячого садка міста Тайбей, який є філією Academia Sinica, дитячий садок щороку наприкінці квітня оголошує набір нових учнів у невеликі та різновікові класи."
21,Зал хол,дитячий садок,Приймають тільки дітей 3-6 років? Або є інші вимоги до вступу?,життя,https://kindergarten.sinica.edu.tw/,02-2787-1451,"Згідно з правилами муніципальних дитячих садків Тайбея, чи відкриті вони лише для дітей віком 3-6 років? Відповідь «ні». Згідно з правилами муніципального дитячого садка Тайбея, до дитячих садків приймають лише дітей віком від 3 до 6 років, але існують інші вимоги до прийому, зокрема:

*Вік студента: Вік вступу, оголошений міським управлінням освіти Тайбею для кожного семестру, має переважну силу.

*Зареєстровані в місті Тайбей: діти повинні бути зареєстровані в місті Тайбей, щоб мати право на вступ.

*Особливі здібності: Дитсадок також приймає дітей з особливими здібностями, але вони повинні"
22,Зал хол,дитячий садок,Що означає розрахувати охоплення дітей повного курсу за їх шкільним віком?,життя,https://kindergarten.sinica.edu.tw/,02-2787-1451,"Відповідно до розпоряджень Управління освіти уряду міста Тайбей вік зарахування дітей до приватних дитячих садків у місті Тайбей є віком вступу для кожного семестру. Тому, коли приватний дитячий садок міста Тайбей, який є філією Academia Sinica, зараховує нових учнів у невеликі класи та класи змішаного віку, вік зарахування залежить від віку зарахування Вік вступу для маленьких дітей. Іншими словами, діти, яким на момент вступу до школи наприкінці квітня щороку виповнюється 3-6 років, можуть записатися до школи."
23,Зал хол,дитячий садок,https://kinder,життя,https://kindergarten.sinica.edu.tw/,02-2787-1451,"Згідно з правилами приватного дитячого садка міста Тайбей, афілійованого з Academia Sinica, дитячий садок має загалом 4 класи: малий клас, середній клас, великий клас і різновіковий клас. Кожен клас приймає 30 дітей. Наприкінці квітня кожного року, оголошує набір нових учнів у малокомплектні та різновікові класи Цільовий набір дітей віком 3-6 років Набір дітей повного курсу розраховується за віком учнів (виходячи з віку вступу до кожен семестр, оголошений Бюро освіти міста Тайбей). URL-адреса https://kindergarten"
