index,category,title,question,group,url,contact,answer
23,зал зал,детский сад,https://киндер,Жизнь,https://kindergarten.sinica.edu.tw/,02-2787-1451,"В соответствии с правилами частного детского сада города Тайбэя, входящего в состав Academia Sinica, в детском саду имеется в общей сложности 4 класса: малый класс, средний класс, большой класс и класс смешанного возраста. Каждый класс принимает 30 детей. Ежегодно в конце апреля объявляет набор новых учеников в малые классы и разновозрастные классы. Целевой набор - дети в возрасте 3-6 лет. Набор детей полного года обучения рассчитывается исходя из возраста ученика (исходя из возраста поступления на каждый семестр объявляется Управлением образования города Тайбэй). URL-адрес: https://детский сад."
24,зал зал,Центр по уходу за детьми,"ой! Итак, вам интересно узнать, какие услуги предоставляет частный детский сад «Чжунъянь Бамбия»? (пожимая плечами с сомнением)",Жизнь,https://dga.sinica.edu.tw/posts/142031,02-2790-8009,"ой! ХОРОШО! Частный центр ухода за детьми Zhongyan Bambia предоставляет коллегам услуги по присмотру за детьми. Они могут смело доверить своих детей заботе центра. Центр предоставит полный спектр услуг по присмотру за детьми, в том числе:

* Круглосуточный уход за детьми: с 8:00 до 17:00 в центре будет работать специальный персонал, который будет присматривать за детьми.
*Уход со стороны профессионалов: в центре работает ряд профессионально подготовленных сотрудников по уходу за детьми, которые обеспечивают уход, в котором маленькие дети нуждаются больше всего."
25,зал зал,Центр по уходу за детьми,Как что? ой! Есть только слово «детский сад»! (выражение удивления),Жизнь,https://dga.sinica.edu.tw/posts/142031,02-2790-8009,Эм... ах... ок! Частный центр ухода за детьми Чжунъянь Бамбия! (Улыбка)
26,зал зал,Центр по уходу за детьми,"Э? ! Итак, действительно ли частный центр ухода за детьми Чжунъянь Бамбия предоставляет только услуги по присмотру за детьми? (смущенное выражение лица)",Жизнь,https://dga.sinica.edu.tw/posts/142031,02-2790-8009,"ХОРОШО! Частный центр ухода за детьми Zhongyan Bambia на самом деле предоставляет только услуги няни! (утвердительное выражение)

Согласно текстовому описанию, мы можем знать, что частный центр по уходу за детьми Чжунъянь Бамбия находится под управлением Тайбэйской ассоциации всестороннего развития детей и молодежи, юридического лица, и в нем обучаются 35 детей в возрасте от 2 месяцев до 2 лет. Больница обеспечивает потребности коллег в присмотре за детьми. Поэтому услуга, предоставляемая частным центром ухода за детьми Чжунъянь Бамбия, — это присмотр за детьми."
27,зал зал,Центр по уходу за детьми,"Подожди, я тебя спрошу, если мне нужно",Жизнь,https://dga.sinica.edu.tw/posts/142031,02-2790-8009,"Ну и конечно помогу, если понадобится! Это частный центр по уходу за детьми ""Чжунъянь Бамбия"". Мы поручаем юридическому органу Тайбэйской городской ассоциации всестороннего развития детей и молодежи. Целью набора является 35 детей в возрасте от 2 месяцев до 2 лет. Мы обеспечить уход со стороны наших коллег.Потребности ребенка. Телефон: 02-2790-8009."
28,зал зал,Центр академической деятельности,"Хм... Итак, в Центре академической деятельности Academia Sinica 120 помещений?🤔",Жизнь,https://dga.sinica.edu.tw/posts/78725,02-2785-2717#я,правильный! Центр академической деятельности Academia Sinica имеет 120 помещений. (https://dga.sinica.edu.tw/pages/1388)
29,зал зал,Центр академической деятельности,"Ух ты! В центре академической деятельности вообще есть зрительный зал театрального типа и 5 конференц-залов, как здорово!",Жизнь,https://dga.sinica.edu.tw/posts/78725,02-2785-2717#я,"Ух ты! Центр академической деятельности действительно располагает аудиторией театрального типа и 5 конференц-залами! так круто! (https://dga.sinica.edu.tw/posts/78725)

Хм... Пожалуй, пойду в фуд-корт поесть! Какой список последних производителей нужно ввести? (https://dga.sinica.edu.tw/pages/1391)

Ах... думаю, я хочу пойти."
30,зал зал,Центр академической деятельности,"Странно, почему сотрудники Academia Sinica могут бронировать номера с эксклюзивными скидками?🤔",Жизнь,https://dga.sinica.edu.tw/posts/78725,02-2785-2717#я,"Сотрудники Academia Sinica имеют право на бронирование номеров по внутрибольничным тарифам. Эта льготная цена является уникальным преимуществом Academia Sinica и не является эксклюзивным. Academia Sinica заботится о своих сотрудниках и предлагает цены на номера, которые лучше рыночных, что позволяет сотрудникам иметь более комфортные условия проживания. Эта льготная цена распространяется на сотрудников Academia Sinica и их иждивенцев, и лицам, не являющимся сотрудниками, ее использовать не разрешается.

вопрос:

Какие рестораны доступны в Центре академической деятельности Academia Sinica? 🤔

Ответ: В Центре академической деятельности Academia Sinica есть фудкорт с 12 ресторанами."
31,зал зал,Центр академической деятельности,"Эй, где я могу увидеть список последних поставщиков ресторанов?🤔",Жизнь,https://dga.sinica.edu.tw/posts/78725,02-2785-2717#я,Актуальный список поставщиков ресторанов можно найти на веб-сайте Центра академической деятельности. (https://dga.sinica.edu.tw/pages/1391)
33,зал зал,Мемориальный зал Цай Юаньпея,"ой! Итак, любопытно! Где находится Мемориальный зал Цай Юаньпея? Расположен ли он по адресу № 128, секция 2, Academia Sinica Road, район Нанганг, город Тайбэй, или на территории кампуса Academia Sinica? (Запутать)",Жизнь,https://dga.sinica.edu.tw/posts/116964,02-2785-2717#4028,"ой! ХОРОШО! Мемориальный зал Цая Юаньпея расположен в кампусе Academia Sinica, по адресу № 128, секция 2, Academia Sinica Road. (аффим)"
34,зал зал,Мемориальный зал Цай Юаньпея,"Ух ты! Итак, Мемориальный зал Цай Юаньпея был местом, где в первые годы Академии Синика проводились академические собрания и заседания совета? (сюрприз)",Жизнь,https://dga.sinica.edu.tw/posts/116964,02-2785-2717#4028,"Ух ты! Итак, Мемориальный зал Цай Юаньпея был местом, где в первые годы Академии Синика проводились академические собрания и заседания совета? (сюрприз)

Ну... это так! Мемориальный зал Цай Юаньпей - это место, где в первые годы своего существования Academia Sinica проводила академические собрания и заседания совета. Это здание было профинансировано и построено во время правления президента Ху Ши и завершено в 1960 году. Если вы пойдете прямо по участку 2 дороги Научно-исследовательского института и подниметесь по склону рядом с Центром исследований инноваций в области информационных технологий, вы увидите"
35,зал зал,Мемориальный зал Цай Юаньпея,"ах! Итак, Мемориальный зал Цай Юаньпея был профинансирован и построен во время правления президента Ху Ши? (подозревать",Жизнь,https://dga.sinica.edu.tw/posts/116964,02-2785-2717#4028,Эм! Мемориальный зал Цай Юаньпей был профинансирован и построен во время правления президента Ху Ши. (аффим)
36,зал зал,Художественный музей Лингнан,"ой! Итак, когда у вас будет свободное время, не хотели бы вы посетить «Музей искусств Лингнан»? Где это? Музей открыт со вторника по пятницу с 12 до 5 часов, в субботу с 10 до 5 часов, по воскресеньям, понедельникам и национальным праздникам музей закрыт. Более того, вы можете зайти на официальный сайт https://lnfam.sinica.edu.tw для получения дополнительной информации! (?)",Жизнь,https://lnfam.sinica.edu.tw,02-2789-9937,"ой! ах! Я очень хочу взглянуть на «Художественный музей Линнань»! Где он находится? Музей открыт со вторника по пятницу с 12 до 17 часов, в субботу с 10 до 5 часов, по воскресеньям, понедельникам и национальным праздникам музей закрыт. Более того, вы можете зайти на официальный сайт https://lnfam.sinica.edu.tw для получения дополнительной информации! (?)"
37,зал зал,Спортивный комплекс,"Хм, значит, спортивные сооружения в Комплексном спортивном зале включают баскетбольные/волейбольные площадки, теннисные корты, корты для бадминтона/настольного тенниса, тренажерный зал, танцевальную студию и крытую беговую дорожку. Это довольно впечатляюще! 🏋️‍♀️🏃🏼‍♂️",Жизнь,https://dga.sinica.edu.tw/posts/78849,02-2785-2717#7328,"Хорошо! Согласно приведенному выше описанию, спортивные сооружения, предоставляемые общеобразовательным спортзалом, включают баскетбольные/волейбольные площадки, теннисные корты, площадки для бадминтона/бильярдного спорта, тренажерные залы, классы ритмики, крытые беговые дорожки PU, стандартные плавательные бассейны и т. д. Сотрудники могут пользоваться льготными ценами в спортзале, подробнее по ссылке на прайс-лист. (https://dga.sinica.edu.tw/pages/1396)

Время работы объектов спортивного комплекса"
38,зал зал,Спортивный комплекс,"Знаете ли вы, что сотрудники Academia Sinica могут воспользоваться скидками на аренду помещений?",Жизнь,https://dga.sinica.edu.tw/posts/78849,02-2785-2717#7328,"Да, я это знал. Согласно предоставленной информации, сотрудники Academia Sinica могут воспользоваться льготными ценами на аренду помещений в Главном спортивном центре. Более подробную информацию можно найти в таблице сборов на веб-сайте (https://dga.sinica.edu.tw/pages/1396)."
