category,title,question,group,url,contact,answer
研究人員及研究技術人員,保險,全民健康保險與公教人員保險有什麼不同嗎？,人事,https://www.sinica.edu.tw/ch/articles/478,中研院人事室,全民健康保險和公教人員保險的一些主要區別在於它們的涵蓋範圍和給付類型。大家公教人員保險主要包括失能給付、養老給付、死亡給付、眷屬喪葬津貼、生育給付（限女性）、育嬰留職停薪津貼等，這只是對個人提供保險。另一方面，全民健康保險提供的是包括本人及其眷屬在內的醫療保險，涵蓋日常就醫、急診等綜合性醫療服務。所以，基本上，公教人員保險偏重在個人福利，而全民健康保險則更偏重在醫療保護。
研究人員及研究技術人員,保險,全民健康保險都涵蓋哪些醫療服務呢？,人事,https://www.sinica.edu.tw/ch/articles/478,中研院人事室,全民健康保險涵蓋的醫療服務包括日常就醫和急診等綜合性醫療服務。
約聘僱人員,薪資待遇,約聘僱人員有分成哪三類呢？,人事,https://www.sinica.edu.tw/ch/articles/473,中研院人事室,約聘僱人員有分成人事費項下約聘僱人員、業務費項下約聘僱人員，還有培育型博士後研究學者這三類。
約聘僱人員,薪資待遇,人事費項下約聘僱人員的薪資是根據什麼標準來定的呢？,人事,https://www.sinica.edu.tw/ch/articles/473,中研院人事室,人事費項下約聘僱人員的薪資是根據中央研究院約聘人員支給酬金標準表來定的。
約聘僱人員,薪資待遇,業務費項下約聘僱人員的薪酬是如何處理的？,人事,https://www.sinica.edu.tw/ch/articles/473,中研院人事室,業務費項下的約聘僱人員，他們的薪酬處理方式主要是根據中央研究院的規定。包括中央研究院約聘僱人員處理原則、專案研究工作酬金支給標準表、還有專案行政管理工作酬金支給標準表。依照這些標準表和規定，才會進行薪酬的確定。
約聘僱人員,薪資待遇,培育型博士後研究學者的聘期是多久呢？,人事,https://www.sinica.edu.tw/ch/articles/473,中研院人事室,培育型博士後研究學者的聘期是六年喔。
約聘僱人員,薪資待遇,這三類約聘僱人員的年薪都包含哪些部分嗎？,人事,https://www.sinica.edu.tw/ch/articles/473,中研院人事室,這三類約聘僱人員的年薪都包含月薪和獎金兩部分。月薪是基本工資，會扣掉一些像是勞工保險、勞工退休金自行提撥和健保那些扣繳項目。另外，他們還會有年終時的工作獎金。
約聘僱人員,薪資待遇,他們的月薪結構是什麼樣子的？,人事,https://www.sinica.edu.tw/ch/articles/473,中研院人事室,他們的月薪結構主要是由本薪組成的，並且還有一些扣繳項目，比如說勞工保險、勞工退休金自行提撥，還有健保等等。
約聘僱人員,薪資待遇,獎金部分都包含哪些呢？,人事,https://www.sinica.edu.tw/ch/articles/473,中研院人事室,獎金部分就是年終工作獎金。
約聘僱人員,保險,約聘僱員工的保險包含哪些呢？,人事,https://www.sinica.edu.tw/ch/articles/473,中研院人事室,約聘僱員工的保險有勞工保險和全民健康保險兩種。勞工保險又可以分為普通事故保險、就業保險和職業災害保險。普通事故保險有生育、傷病、失能、老年和死亡五種給付。就業保險則包含育嬰留職停薪津貼和失業兩種給付。職業災害保險有傷病、醫療、失能和死亡四種給付。至於全民健康保險，則提供日常就醫和急診的服務。
約聘僱人員,保險,我到職後和離職時怎麼辦理保險呢？,人事,https://www.sinica.edu.tw/ch/articles/473,中研院人事室,當你到職或是離職時，我們都會依照勞工保險條例和全民健康保險法的規定來為你辦理。我們會根據規定，為你辦理勞工保險的加保或退出，同時也會根據全民健康保險法的要求，透過我們的人事室為你本人及你的眷屬辦理加保或退出。這樣確保你能在工作期間或是離職後，享有平安保障，及時接受醫療服務。
約聘僱人員,保險,勞工保險有哪些給付種類，可以簡單說明一下嗎？,人事,https://www.sinica.edu.tw/ch/articles/473,中研院人事室,勞工保險包括普通事故保險、就業保險和職業災害保險這三種保險。普通事故保險主要包含生育、傷病、失能、老年和死亡這五種給付。就業保險則分為育嬰留職停薪津貼和失業這兩種給付。職業災害保險主要包含傷病、醫療、失能和死亡這四種給付。
約聘僱人員,保險,全民健康保險對於眷屬也有加保退保的服務嗎？,人事,https://www.sinica.edu.tw/ch/articles/473,中研院人事室,是的，全民健康保險的確有提供眷屬的加保和退保服務。這是由中央研究院人事室負責辦理的。
約聘僱人員,保險,全民健康保險提供的綜合性醫療服務包含哪些內容呢？,人事,https://www.sinica.edu.tw/ch/articles/473,中研院人事室,全民健康保險主要提供日常就醫和急診這兩種綜合性的醫療服務。
