category,title,question,group,url,contact,answer
兼職,兼職管制態樣(四)報備類,中研院公告的其他兼職情形，通常包含哪些內容呢？,人事,https://www.sinica.edu.tw/ch/articles/332,中研院人事室,這部分沒有具體的內容，因為“其他經中研院公告之情形”可以包含各種不同的兼職情形。所以實際內容會根據中研院的公告而有所變化。
兼職,兼職管制態樣(五)免除管制類,中研院的研究人員和技術人員，在哪些情況下不需要申請或核准就可以兼職？,人事,https://www.sinica.edu.tw/ch/articles/332,中研院人事室,中研院的研究人員和技術人員在三種情況下就不需要申請或核准就可以兼職。第一種情況是他們可以兼任政府機關、公立學校、行政法人的任務編組職務或是臨時需要設立的職務。第二種情況是在工作時間以外，如果他們用自己的才藝表現來獲得報酬，或者是透過處理自己財產、智慧財產權以及肖像權的授權行使來獲得合理的對價，這樣也是可以的。還有最後一種情況就是任何經由中研院公告同意的情形，他們也是可以兼職的.
兼職,兼職管制態樣(五)免除管制類,研究人員兼任政府機關或公立學校的職務等，需要申請同意或核准嗎？,人事,https://www.sinica.edu.tw/ch/articles/332,中研院人事室,研究人員如果要兼任政府機關或公立學校的職務，是不需要申請同意或核准的。
兼職,兼職管制態樣(五)免除管制類,在工作時間以外，個人才藝表現獲取報酬的研究人員，還需要辦理兼職揭露嗎？,人事,https://www.sinica.edu.tw/ch/articles/332,中研院人事室,不需要，只要是在工作時間以外，研究人員依據自身的才藝表現，獲得適當的報酬，就不需要提出申請，也不需要進行兼職揭露。
兼職,兼職管制態樣(五)免除管制類,獲取智慧財產權和肖像權授權的研究人員，需要申請同意兼職嗎？,人事,https://www.sinica.edu.tw/ch/articles/332,中研院人事室,不需要，只要他們是在工作時間以外根據個人的技能表現獲取報酬，並且他們對於自己的財產、智慧財產權和肖像權的授權可以得到合理的回報，他們就不需要申請同意和核准兼職。
兼職,兼職管制態樣(五)免除管制類,除了以上情形，還有哪些情況是中研院會公告免核准兼職的？,人事,https://www.sinica.edu.tw/ch/articles/332,中研院人事室,文字說明裡面沒有提到其他會公告免核准兼職的情況，如果有其他情況應該會在中研院的公告中看到。
兼職,定義規範之兼職事項,中研院是怎麼規範研究人員和研究技術人員在外面兼職的呢？,人事,https://www.sinica.edu.tw/ch/articles/332,中研院人事室,中研院為了規範研究人員和研究技術人員在外面兼職的事情，特別訂定了一個名為中央研究院研究人員及研究技術人員兼職處理原則的規定。
兼職,定義規範之兼職事項,「中央研究院研究人員及研究技術人員兼職處理原則」是什麼？,人事,https://www.sinica.edu.tw/ch/articles/332,中研院人事室,這是中研院為了規範他們的研究人員與研究技術人員在中研院以外的兼職事宜而特別訂定的。
兼職,兼職消極條件,如果我的兼職工作跟我在中研院的工作性質有關，會不會不被核准？,人事,https://www.sinica.edu.tw/ch/articles/332,中研院人事室,如果你的兼職工作性質和你在中研院的本職工作衝突或者可能對你的本職工作有不良影響，或者有可能損害中研院的形象，那麼你的兼職可能不會被核准哦。還有，如果涉及到公務機密、營私舞弊、不當得利等情況，也有可能不被允許你兼職。所以最好還是確保你的兼職和你在中研院的工作沒有衝突，並且對中研院沒有不良的影響。
兼職,兼職消極條件,如果我背諗學術倫理，我還能不能繼續兼職？,人事,https://www.sinica.edu.tw/ch/articles/332,中研院人事室,如果你違反學術倫理，那對不起，你不能繼續兼職了。
兼職,兼職消極條件,如果我兼職有可能會洩露公務機密，我能不能繼續兼職？,人事,https://www.sinica.edu.tw/ch/articles/332,中研院人事室,如果你兼職可能會洩露公務機密，中研院是不會允許你這麼做的。
兼職,兼職消極條件,如果我兼職有損中研院的形象，還能不能允許我兼職？,人事,https://www.sinica.edu.tw/ch/articles/332,中研院人事室,如果你的兼職可能損壞中研院的形象，那就不能讓你繼續兼職了。
兼職,兼職消極條件,如果我兼職可能會影響到我的本職工作效能，這樣會不會被要求停止兼職？,人事,https://www.sinica.edu.tw/ch/articles/332,中研院人事室,是的，如果你的兼職可能會影響到你本職的工作效能，中研院是可能會要求你停止兼職的。
兼職,兼職消極條件,如果我兼職有可能幫助我營私舞弊，這樣會被廢止核准嗎？,人事,https://www.sinica.edu.tw/ch/articles/332,中研院人事室,是的，如果你的兼職有可能讓你營私舞弊，中研院是會廢止你兼職的核准的。
兼職,兼職消極條件,如果我兼職可能有不當利用中研院公物之虞，還能否繼續兼職?,人事,https://www.sinica.edu.tw/ch/articles/332,中研院人事室,如果你兼職有可能不當利用中研院的公物，那麼就不能繼續兼職了。
兼職,兼職消極條件,如果我兼職可能造成人員安全或健康的風險，我能否繼續兼職呢？,人事,https://www.sinica.edu.tw/ch/articles/332,中研院人事室,如果你的兼職可能導致人員安全或健康的風險，那麼根據中研院的規定，你不能繼續兼職。
兼職,兼職消極條件,如果我兼職可能造成利益衝突，那麼我還可以繼續兼職嗎？,人事,https://www.sinica.edu.tw/ch/articles/332,中研院人事室,不行，如果兼職可能造成利益衝突，中研院是不會允許的。
兼職,兼職消極條件,.如果我兼職可能涉及支用公款的情況，我還能不能繼續兼職？,人事,https://www.sinica.edu.tw/ch/articles/332,中研院人事室,如果你的兼職有可能涉及到使用公款，那就不能繼續兼職了。
兼職,兼職消極條件,.如果違反了倫理事項或學術研究績效評核結果，我還可以繼續兼職嗎？,人事,https://www.sinica.edu.tw/ch/articles/332,中研院人事室,不行喔，如果違反了倫理事項或學術研究績效評核結果，你就不能繼續兼職了。
兼職,兼職時數及兼職費,中研院的研究員和研究技術人員每週內兼職的時數上限是多少小時呢？,人事,https://www.sinica.edu.tw/ch/articles/332,中研院人事室,中研院的研究員和研究技術人員每週內兼職的時數上限是8小時。
兼職,兼職時數及兼職費,中研院的研究員和研究技術人員最多能兼任幾個新創公司董事或非執行經營業務的職位呢？,人事,https://www.sinica.edu.tw/ch/articles/332,中研院人事室,他們最多能兼任四個這類的職位。
兼職,兼職時數及兼職費,中研院會如何公告研究人員和研究技術人員的兼職情形呢？,人事,https://www.sinica.edu.tw/ch/articles/332,中研院人事室,中研院會定期公告研究人員和研究技術人員的兼任新創公司董事、發起新事業、獨立董事或其他非執行經營業務等職務的兼職狀況。
兼職,兼職時數及兼職費,研究員的兼職費是依照什麼標準來給付的？他們的費用上限有受到軍公教人員兼職費支給表規定的限制嗎？,人事,https://www.sinica.edu.tw/ch/articles/332,中研院人事室,研究員的兼職費是依照軍公教人員兼職費支給表來給付的。不過，他們的費用上限並不受這項規定的限制。也就是說，他們的兼職費可以超過軍公教人員兼職費支給表所規定的上限。
兼職,到職揭露及年度揭露,到職時我需要填寫什麼文件來揭露我目前的兼任職務？,人事,https://www.sinica.edu.tw/ch/articles/332,中研院人事室,你需要填寫一份「中央研究院人員到職前兼職揭露告知書」來揭露你目前的兼任職務。
兼職,到職揭露及年度揭露,如果我的兼任職務沒有獲得中研院的核准，我該怎麼辦？,人事,https://www.sinica.edu.tw/ch/articles/332,中研院人事室,如果你的兼任職務沒有得到中研院的核准，你應該立即停止兼職。
兼職,到職揭露及年度揭露,每年7月底前需要完成哪些工作？,人事,https://www.sinica.edu.tw/ch/articles/332,中研院人事室,每年7月底前，各單位得整理一份「中央研究院研究人員及研究技術人員兼職揭露表」，並送到中研院備查。同時，也要進行一次評估檢討，看看各位研究人員及研究技術人員的兼職情形，這將作為是否同意他們繼續兼職的參考依據。
兼職,到職揭露及年度揭露,我們如何評估研究人員的兼任情況？,人事,https://www.sinica.edu.tw/ch/articles/332,中研院人事室,每年都要對研究人員和研究技術人員的兼職情況進行評估檢討。用這樣的方式來決定是否同意他們繼續兼職。每年七月底之前，各單位要送過來一份兼職揭露表給我們，裡面會有所有人員的兼任的詳細情況。
兼職,到職揭露及年度揭露,如果我兼任的是新創公司董事或非執行經營業務的職務，我需要填寫哪些文件？,人事,https://www.sinica.edu.tw/ch/articles/332,中研院人事室,你需要填寫「中央研究院人員因應科技移轉與科學研究需要兼職許可書(年度揭露)」這份文件喔。
兼職,到職揭露及年度揭露,我需要將申請的文件送到哪裡處理？,人事,https://www.sinica.edu.tw/ch/articles/332,中研院人事室,你需要把申請的文件送到利管會處理。
兼職,兼職違反規定之處理,如果中研院的研究人員或技術人員違反兼職規定，該怎麼處理呢？,人事,https://www.sinica.edu.tw/ch/articles/332,中研院人事室,如果中研院的研究人員或技術人員違反了兼職規定，就要把他們轉送到中研院學組級倫理委員會，由他們依據中研院各級倫理委員會的設置和作業要點進行審議。
兼職,兼職違反規定之處理,如果發現中研院研究人員違反兼職規定，應該要通報給誰？,人事,https://www.sinica.edu.tw/ch/articles/332,中研院人事室,應該要通報給中研院學組級倫理委員會。
兼職,兼職違反規定之處理,違反兼職規定的中研院研究人員，最後會被交由誰處理？,人事,https://www.sinica.edu.tw/ch/articles/332,中研院人事室,違反兼職規定的中研院研究人員，最後會被中研院學組級倫理委員會來處理。
兼課,兼課,中研院的工作人員可以在不影響工作的情況下去學校教書嗎？,人事,https://www.sinica.edu.tw/ch/articles/331,中研院人事室,可以的，中研院的研究人員和技術人員可以在不影響自己本職工作的情況下去學校教書。但要注意，辦公時間內每週授課時數不可以超過四小時。
兼課,兼課,如果我是中研院的研究人員，我每週能在辦公時間內教多少小時的課？,人事,https://www.sinica.edu.tw/ch/articles/331,中研院人事室,你作為中研院的研究人員，每週在辦公時間內可以授課最多4小時。
兼課,兼課,合聘授課的時間也算在每週授課四小時內嗎？,人事,https://www.sinica.edu.tw/ch/articles/331,中研院人事室,是的，合聘授課的時間也算在每週授課四小時內。
兼課,兼課,研究所或中心要在開學後的哪個時間點彙整研究人員的授課時數和時間表呢？,人事,https://www.sinica.edu.tw/ch/articles/331,中研院人事室,開學後的兩週內要彙整研究人員的授課時數和時間表。
兼課,兼課,中研院研究人員去學校授課，需要哪位主管的同意呢？,人事,https://www.sinica.edu.tw/ch/articles/331,中研院人事室,需要研究所或中心的所長、主任的同意。
兼課,兼課,研究人員去學校授課的公假是怎麼登記的呀？,人事,https://www.sinica.edu.tw/ch/articles/331,中研院人事室,研究人員要去學校授課的話，假單不用填的，他們只要拿到院方的核准公文，就可以用這個公文來取代假單了。然後他們的公假就會由他們所在的研究所或中心來登記。
兼課,兼課,如果中研院的研究人員或研究技術人員去學校授課，是不是要以核准的公文來取代假單呢？,人事,https://www.sinica.edu.tw/ch/articles/331,中研院人事室,對的，如果中研院的研究人員或研究技術人員去學校授課，確實是要用核准的公文來取代假單。
請假,請假規定,我每學年可以請幾天的事假？,人事,https://hro.sinica.edu.tw/pdfjs/full?file=/archives/a0f8f441a677b761#zoom=115&pagemode=thumbs,中研院人事室,你每學年可以請7天事假。
請假,請假規定,如果我家人生病我需要照顧，我可以請幾天的家庭照顧假？,人事,https://hro.sinica.edu.tw/pdfjs/full?file=/archives/a0f8f441a677b761#zoom=115&pagemode=thumbs,中研院人事室,如果你的家人生病需要你照顧，你可以請7天的家庭照顧假。不過要注意的是，這7天會併入事假的日數來計算。如果事假和家庭照顧假的總和超過7天，那麼超出的部分會扣薪。
請假,請假規定,如果我生病需要休息，我可以請多少天的病假？,人事,https://hro.sinica.edu.tw/pdfjs/full?file=/archives/a0f8f441a677b761#zoom=115&pagemode=thumbs,中研院人事室,你生病的話，可以請到28天的病假。
請假,請假規定,假如我結婚了，我可以請幾天的婚假啊？,人事,https://hro.sinica.edu.tw/pdfjs/full?file=/archives/a0f8f441a677b761#zoom=115&pagemode=thumbs,中研院人事室,你結婚的話，可以請14天的婚假。但要注意的是，婚假要在結婚的日期前10天起，3個月內請完。特殊情況需要延長的話，可以經過中研院的核准，最多可以延後到1年內請完這個婚假。
請假,請假規定,如果我懷孕了，我能請多少天的產假？,人事,https://hro.sinica.edu.tw/pdfjs/full?file=/archives/a0f8f441a677b761#zoom=115&pagemode=thumbs,中研院人事室,如果你懷孕，你可以在生產前請8天的產前假，生產後可以請42天的娩假，所以總共可以請50天的產假。但要注意的是，產前假要在生產前請完，不能保留到生產後使用。
請假,請假規定,如果我要陪老婆產檢和生孩子，我能請幾天的陪產檢和陪產假啊？,人事,https://hro.sinica.edu.tw/pdfjs/full?file=/archives/a0f8f441a677b761#zoom=115&pagemode=thumbs,中研院人事室,你可以請7天的陪產檢和陪產假。陪產檢要在老婆懷孕期間請完，而陪產假則要在老婆分娩日或流產日前後15日內請完喔。
請假,請假規定,我的父母或配偶過世了，我可以請多少天的喪假？,人事,https://hro.sinica.edu.tw/pdfjs/full?file=/archives/a0f8f441a677b761#zoom=115&pagemode=thumbs,中研院人事室,如果你的父母或配偶過世，你可以請15天的喪假。
請假,請假規定,我如果要捐贈骨髓或器官，可以請多少天的假呢？,人事,https://hro.sinica.edu.tw/pdfjs/full?file=/archives/a0f8f441a677b761#zoom=115&pagemode=thumbs,中研院人事室,當你要捐贈骨髓或器官時，可以根據實際需要來請假，並沒有特定的天數限制。
請假,請假規定,如果我被召集入伍，中研院會給予公假嗎？,人事,https://hro.sinica.edu.tw/pdfjs/full?file=/archives/a0f8f441a677b761#zoom=115&pagemode=thumbs,中研院人事室,對，如果你被法律召集入伍，中研院會給你公假的。
請假,請假規定,中研院的員工參加政府主辦的投票可以請假嗎？,人事,https://hro.sinica.edu.tw/pdfjs/full?file=/archives/a0f8f441a677b761#zoom=115&pagemode=thumbs,中研院人事室,可以，中研院的員工如果要參加政府主辦的投票，是可以請公假的。
請假,請假規定,如果我在上班途中受傷，中研院會允許我請假兩年嗎？,人事,https://hro.sinica.edu.tw/pdfjs/full?file=/archives/a0f8f441a677b761#zoom=115&pagemode=thumbs,中研院人事室,對的，如果你在上下班途中或是執行研究工作時遭遇危險導致受傷或生病，並且需要休養或治療，那麼在兩年內的時間中研院會給你公假。
請假,請假規定,如果我獲得國外學校的邀請參加學術會議，中研院會同意我請假嗎？,人事,https://hro.sinica.edu.tw/pdfjs/full?file=/archives/a0f8f441a677b761#zoom=115&pagemode=thumbs,中研院人事室,如果你被國外學校邀請參加與研究工作有關的學術會議，中研院是會同意你請假的。
請假,請假規定,我需要出庭作證，這樣可以向中研院申請公假嗎？,人事,https://hro.sinica.edu.tw/pdfjs/full?file=/archives/a0f8f441a677b761#zoom=115&pagemode=thumbs,中研院人事室,你需要出庭作證的話，確實可以向中研院申請公假，只要得到中研院的同意就可以了。
請假,請假規定,如果我被確診為法定傳染病，需要被隔離，這樣可以請公假嗎？,人事,https://hro.sinica.edu.tw/pdfjs/full?file=/archives/a0f8f441a677b761#zoom=115&pagemode=thumbs,中研院人事室,對的，如果你被確診有法定傳染病，並且各級衛生主管機關認定你需要被強制隔離，那你就可以請公假。但是如果你的病是因為你自己的過失造成的，那就無法請公假。
請假,請假規定,中研院有指派參加活動或會議的公假嗎？,人事,https://hro.sinica.edu.tw/pdfjs/full?file=/archives/a0f8f441a677b761#zoom=115&pagemode=thumbs,中研院人事室,是的，中研院的研究人員如果被指派參加活動或會議可以申請公假。
請假,請假規定,病假的時間累積在兩年內不能超過一年嗎？,人事,https://hro.sinica.edu.tw/pdfjs/full?file=/archives/a0f8f441a677b761#zoom=115&pagemode=thumbs,中研院人事室,是的，病假的時間在兩年內累積不能超過一年。
請假,請假規定,假如我已經請公假滿兩年還不能回來工作，會怎麼處理？,人事,https://hro.sinica.edu.tw/pdfjs/full?file=/archives/a0f8f441a677b761#zoom=115&pagemode=thumbs,中研院人事室,如果你請公假已經滿兩年，但還不能回來工作的話，將會被安排留職停薪，或是依照法律程序進行退休或資遣的處理。
請假,請假規定,如果我因為工作受傷的病假超過一年還沒恢復，會有什麼後續的處理方式？,人事,https://hro.sinica.edu.tw/pdfjs/full?file=/archives/a0f8f441a677b761#zoom=115&pagemode=thumbs,中研院人事室,若你因為工作受傷的病假超過一年還沒恢復，根據規定，你可能需要停薪留職或者依法退休或被資遣。但是，如果你的停薪留職是因為你在執行研究工作且有特殊情況，中研院可能會考慮將你的留職期限延長，不過延長的時間最多不能超過一年。
請假,請假規定,我在進行研究工作並且情況特殊，能不能申請將留職停薪的時間再延長呢？,人事,https://hro.sinica.edu.tw/pdfjs/full?file=/archives/a0f8f441a677b761#zoom=115&pagemode=thumbs,中研院人事室,可以的，你的情況由於是進行研究工作且特殊，中研院有權利審酌你的留職停薪時間是否可以再延長。但要注意，這種延長的時間最多只能到1年。
請假,請假規定,如果要延長留職停薪的期間，最長能延長到多久？,人事,https://hro.sinica.edu.tw/pdfjs/full?file=/archives/a0f8f441a677b761#zoom=115&pagemode=thumbs,中研院人事室,最長能延長到1年。
請假,請假規定,如果我因病留職停薪後病癒，可以怎樣申請復職？,人事,https://hro.sinica.edu.tw/pdfjs/full?file=/archives/a0f8f441a677b761#zoom=115&pagemode=thumbs,中研院人事室,如果你因為生病而暫停工作，在停工期間病好了，你可以拿醫療機構或醫生的證明書，去向中研院提出復職的申請。
請假,請假規定,留職停薪期間，我是否需要提供病癒證明書才能申請復職？,人事,https://hro.sinica.edu.tw/pdfjs/full?file=/archives/a0f8f441a677b761#zoom=115&pagemode=thumbs,中研院人事室,如果你在留職停薪期間病癒，需要提供合法醫療機構或醫師的證明書才能申請復職。但如果你在這期間要辦理退休或資遣，就可以不用附病癒證明書就立即申請復職。
請假,請假規定,如果我在留職停薪期間想退休或被資遣，需要提供病癒證明書嗎？,人事,https://hro.sinica.edu.tw/pdfjs/full?file=/archives/a0f8f441a677b761#zoom=115&pagemode=thumbs,中研院人事室,不需要提供病癒證明書，可以直接向中研院申請復職，並且復職當日就會是你的退休或被資遣的生效日。
請假,請假規定,我可以隨時申請退休或資遣嗎？,人事,https://hro.sinica.edu.tw/pdfjs/full?file=/archives/a0f8f441a677b761#zoom=115&pagemode=thumbs,中研院人事室,如果你是中研院的研究人員或研究技術人員，而且正在因病辦理留職停薪，你確實可以隨時申請退休或資遣。只要申請，你就可以以復職的那一天作為退休或資遣的生效日。而且，你申請的時候，不需要提出病癒證明書哦。
請假,請假規定,復職當日算作退休或資遣的生效日是怎麼回事呢？,人事,https://hro.sinica.edu.tw/pdfjs/full?file=/archives/a0f8f441a677b761#zoom=115&pagemode=thumbs,中研院人事室,那是這樣的，當中研院的研究人員或研究技術人員因為生病需要停薪留職時，如果在留職停薪期間，要辦理退休或被資遣，就可以隨時提出復職的申請，而不用附上病癒證明。然後，這個復職的日期就會被算作他們的退休或資遣的生效日。簡單來說就是說，他們退休或資遣的日期就是他們復職當日。
請假,請假規定,我每學年可以休假幾天呢？,人事,https://hro.sinica.edu.tw/pdfjs/full?file=/archives/a0f8f441a677b761#zoom=115&pagemode=thumbs,中研院人事室,每學年你可以休假21天。
請假,請假規定,如果我今年的假期沒有休完，明年可以繼續休嗎？,人事,https://hro.sinica.edu.tw/pdfjs/full?file=/archives/a0f8f441a677b761#zoom=115&pagemode=thumbs,中研院人事室,是的，你今年的假期如果沒有休完，明年可以繼續休。但如果明年你還是沒有休完，那就會被視為放棄了。
請假,請假規定,如果我今年的假期未休完，不休的部分會有加班費嗎？,人事,https://hro.sinica.edu.tw/pdfjs/full?file=/archives/a0f8f441a677b761#zoom=115&pagemode=thumbs,中研院人事室,不會，如果你今年的假期未休完，沒休的部分是不支給加班費的。
請假,請假規定,如果我於九月以後入職，如何計算我的休假天數呢？,人事,https://hro.sinica.edu.tw/pdfjs/full?file=/archives/a0f8f441a677b761#zoom=115&pagemode=thumbs,中研院人事室,如果你九月以後入職，你的休假天數會按照從你開始工作的那個月到學年結束的時間來計算。如果計算結果未滿半日，就當作半日計算；超過半日但不到一天的，就算是一天。然後當下個學年8月開始，你就有21天的休假可以使用了。
請假,請假規定,如果我在職不滿一學年的話，休假天數是如何計算的？,人事,https://hro.sinica.edu.tw/pdfjs/full?file=/archives/a0f8f441a677b761#zoom=115&pagemode=thumbs,中研院人事室,如果你在職不滿一學年，休假天數會根據你的在職月數比例來計算。如果計算後的天數不滿半日，那就以半日來計算，但如果超過半日又不滿一日，那就會算作一日休假。
請假,請假規定,若我任職不滿一學年，依照在職天數計算後，不滿半日的休假該怎麼算呢？,人事,https://hro.sinica.edu.tw/pdfjs/full?file=/archives/a0f8f441a677b761#zoom=115&pagemode=thumbs,中研院人事室,如果你的在職天數算出來的休假不滿半日，那就算半日休假。
請假,請假規定,若我任職不滿一學年，依照在職天數計算後，超過半日卻不滿一日的休假該如何計算呢？,人事,https://hro.sinica.edu.tw/pdfjs/full?file=/archives/a0f8f441a677b761#zoom=115&pagemode=thumbs,中研院人事室,如果你任職不滿一學年，且依照在職天數計算後，你的休假天數超過半日但不滿一日，那麼你的休假天數會被算做一整天。
請假,請假規定,從次學年八月起，我可以休幾天假呢？,人事,https://hro.sinica.edu.tw/pdfjs/full?file=/archives/a0f8f441a677b761#zoom=115&pagemode=thumbs,中研院人事室,你可以休21天假。
請假,請假規定,如果我沒在次學年休完的假期，會怎麼處理呢？,人事,https://hro.sinica.edu.tw/pdfjs/full?file=/archives/a0f8f441a677b761#zoom=115&pagemode=thumbs,中研院人事室,如果你在次學年沒有休完假期，那就會被認為你選擇放棄了剩下的假期。
