category,title,question,group,url,contact,answer
兼職,兼職管制態樣(一)禁止類,那你覺得中研院的這項規定，對研究人員和研究技術人員的影響最大嗎？他們可能因為這項規定受到限制嗎？為什麼？,人事,https://www.sinica.edu.tw/ch/articles/332,中研院人事室,"根據中研院的規定，研究人員和研究技術人員不得兼任他項公職或領證職業，否則將受罰。這意味著他們不能擔任民意代表、中央與地方機關的公務員、或依法令從事公務者。這可能影響他們參與公共事務或參與政府機關的決策過程。

中研院研究人員和研究技術人員不得兼任營利事業職務，但經核准者不在此限。這可能影響他們參與商業活動或創業"
兼職,兼職管制態樣(二)特別許可類,那你對中研院的兼職管制態樣(二)特別許可類有何看法？中研院允許研究人員及研究技術人員擔任哪些營利事業職務？,人事,https://www.sinica.edu.tw/ch/articles/332,中研院人事室,"依據中研院規定，研究人員及研究技術人員經核准得擔任下列營利事業職務：
(一)經公股股權管理機關(構)指派代表公股或遴薦兼任政府直接或間接投資事業之董事、監察人或相類似職務。
(二)主要研發技術提供者擔任與中研院訂有科技移轉契約之新創公司董事，且兼任期間須在契約有效期限內。
(三)主要"
兼職,兼職管制態樣(二)特別許可類,啊？好奇怪？還是覺得不可思議？還是有其他什麼想法？,人事,https://www.sinica.edu.tw/ch/articles/332,中研院人事室,"好奇怪？還是覺得不可思議？還是有其他什麼想法？

語氣：驚訝、奇怪、不可思議、其他想法

理由：中研院研究人員及研究技術人員經中研院核准得擔任營利事業職務，這實在令人驚訝與不可思議。或許是中研院為了推動產學合作，而與營利事業簽署合作契約，讓中研院研究人員及研究技術人員參與創辦新事業，或擔任獨立董事。或許是中研院為了支援科學研究"
兼職,兼職管制態樣(二)特別許可類,嗯？什麼事？想知道更多關於兼職管制態樣的資訊嗎？,人事,https://www.sinica.edu.tw/ch/articles/332,中研院人事室,"中研院研究人員及研究技術人員依據中研院核准的職務，得擔任營利事業職務，但須符合相關規定。包括：

*經公股股權管理機關指派代表公股或遴薦兼任政府直接或間接投資事業之董事、監察人或相類似職務。
*主要研發技術提供者擔任與中研院訂有科技移轉契約之新創公司董事，且兼任期間須在契約有效期限內。
*主要"
兼職,兼職管制態樣(二)特別許可類,喔？那你知道哪些人可以擔任中研院的兼職嗎？主要研發技術提供者可以擔任哪些職務？,人事,https://www.sinica.edu.tw/ch/articles/332,中研院人事室,"依據中研院規定，研究人員及研究技術人員經核准得擔任下列營利事業職務：

一、經公股股權管理機關(構)指派代表公股或遴薦兼任政府直接或間接投資事業之董事、監察人或相類似職務。
二、主要研發技術提供者擔任與中研院訂有科技移轉契約之新創公司董事，且兼任期間須在契約有效期限內。
三、主要研發技術"
兼職,兼職管制態樣(二)特別許可類-解任登記,那你需要根據服務項目和服務說明，使用日常說話語氣，提出以下問題：,人事,https://www.sinica.edu.tw/ch/articles/332,中研院人事室,好啊，那我大概會用日常說話語氣回答你吧！首先，中研院研究人員和研究技術人員到職前，如果想去營利事業工作，就得辦理解任登記；如果沒在期限內完成解任登記，並經中研院同意，還可能延長；但延長期間內，不能參與經營和支領報酬。所以，如果想去營利事業工作，就得先辦理解任登記，否則就只能做
兼職,兼職管制態樣(二)特別許可類-解任登記,中研院研究人員及研究技術人員如果在職前，需要在到職前擔任營利事業職務時辦理解任登記，為什麼？,人事,https://www.sinica.edu.tw/ch/articles/332,中研院人事室,根據中研院規定，中研院研究人員及研究技術人員到職前若需擔任營利事業職務，須辦理解任登記，這是因為中研院是政府捐助設立的財團法人，受政府監督，而政府為保障國家利益及公共利益，對於研究人員及研究技術人員的任用，有必要加以規範。因此，中研院要求研究人員及研究技術人員到職前若需擔任營利事業職務，須先辦理解任登記，
兼職,兼職管制態樣(二)特別許可類-解任登記,為什麼在3個月內完成解任登記是必須的？,人事,https://www.sinica.edu.tw/ch/articles/332,中研院人事室,根據中研院的規定，研究人員及研究技術人員到職前若已辦理解任登記，就必須在到職時提出書面辭職，並於3個月內完成解任登記，並向中研院繳交有關證明文件。這是因為中研院是政府機關，為確保研究人員及研究技術人員的行政中立性，所以有此規定。如果無法在期限內完成解任登記，且經中研院同意者，得延長其期間，
兼職,兼職管制態樣(二)特別許可類-解任登記,如果因為特殊情況未能依限完成解任登記，可以延長多久？,人事,https://www.sinica.edu.tw/ch/articles/332,中研院人事室,根據中研院的規定，如果因特殊情況未能依限完成解任登記，可以延長的時間為3個月。
兼職,兼職管制態樣(二)特別許可類-解任登記,在完成解,人事,https://www.sinica.edu.tw/ch/articles/332,中研院人事室,"根據下列文字說明，使用日常說話語氣回答問題：

中研院研究人員及研究技術人員到職前，若曾任營利事業職務，就必須辦理理解任登記。至遲應於到職時提出書面辭職，並於3個月內完成解任登記，並向中研院繳交相關證明文件。如果因特殊情形未能依限完成解任登記，並經中研院同意者，得延長其期間，但最"
兼職,兼職管制態樣(二)特別許可類-辦理程序,請問兼職人員應如何填列「中央研究院人員因應科技移轉與科學研究需要兼職許可書」？,人事,https://www.sinica.edu.tw/ch/articles/332,中研院人事室,根據中研院的規定，兼職人員應由兼職之新創公司或營利事業來函，填列「中央研究院人員因應科技移轉與科學研究需要兼職許可書」，並由所屬研究所(處)務會議或研究中心業務會議審查通過後，移送中研院利益衝突管理委員會審議，並經中研院核准。
兼職,兼職管制態樣(二)特別許可類-辦理程序,中研院研究人員兼任新創公司董事，應由誰來函？,人事,https://www.sinica.edu.tw/ch/articles/332,中研院人事室,根據中研院的規定，中研院研究人員兼任新創公司董事者，應由該新創公司來函，經所屬研究所(處)、研究中心主管同意及中研院核准。
兼職,兼職管制態樣(二)特別許可類-辦理程序,中研院如何審查兼職人員的兼職申請？,人事,https://www.sinica.edu.tw/ch/articles/332,中研院人事室,"中研院依據《中央研究院人員因應科技移轉與科學研究需要兼職許可辦法》第3條規定，對於兼職人員的兼職申請案，應由所屬研究所(處)、研究中心主管初審，並送交所屬院務會議或研究中心業務會議審查。

審查重點包括：

1. 是否符合《中央研究院人員因應科技移轉與科學研究需要兼職許可辦法》第3條第1項規定的兼職"
兼職,兼職管制態樣(二)特別許可類-辦理程序,兼任獨立董事的程序為何？,人事,https://www.sinica.edu.tw/ch/articles/332,中研院人事室,"依據中研院規定，兼任獨立董事的程序為：

1.兼職人員於應邀提名選任時，應經所屬研究所(處)、研究中心主管同意及中研院核准。
2.經選任為獨立董事職務時，應請該營利事業於股東會後首次董事會作成自兼職人員經選任為獨立董事之日起3個月內，與中研院完成簽訂產研合作契約並同意繳交"
兼職,兼職管制態樣(二)特別許可類-辦理程序,若兼職人員無法完成產研合作契約及同意繳交學術回饋金，中研院將如何處理,人事,https://www.sinica.edu.tw/ch/articles/332,中研院人事室,依據中研院的規定，如果兼職人員無法完成產研合作契約及同意繳交學術回饋金，中研院將不予核准其兼職。也就是說，如果兼職人員無法如期完成上述程序，中研院將不予許可其兼職。
兼職,兼職管制態樣(二)特別許可類-利益迴避、利益揭露,那段服務內容提到哪些人員需要揭露利益關係？,人事,https://www.sinica.edu.tw/ch/articles/332,中研院人事室,"依據中研院規定，需揭露利益關係的人員包括：

1.中研院研究人員及研究技術人員兼任新創公司董事或營利事業非執行經營業務職務者。
2.中研院研究人員及研究技術人員兼任與中研院訂有科技移轉或資助研究契約之新創公司董事或營利事業非執行經營業務職務者。
3.中研院研究人員及研究技術人員及其配偶、未成年子女、父母、祖父母"
兼職,兼職管制態樣(二)特別許可類-利益迴避、利益揭露,哪些情形下，兼職人員不得兼職？,人事,https://www.sinica.edu.tw/ch/articles/332,中研院人事室,"依據中研院規定，兼職人員有下列情形之一者，不得兼職：

1. 經利管會審議認定有利益衝突之情事且無法採取利益迴避管理措施者。
2. 於兼職期間及終止後2年內，應迴避與原兼職之新創公司、營利事業及其關係企業間有關採購或計畫審查之業務。
3. 各單位知有應自行迴避而"
兼職,兼職管制態樣(二)特別許可類-利益迴避、利益揭露,兼職人員需於何時迴避？,人事,https://www.sinica.edu.tw/ch/articles/332,中研院人事室,依據中研院規定，兼職人員需於兼職期間及終止後2年內迴避與原兼職之新創公司、營利事業及其關係企業間有關採購或計畫審查之業務。但若迴避反不利於公平競爭或公共利益時，得報院同意後免除迴避。因此，兼職人員需於兼職期間及終止後2年內迴避與原兼職之新創公司、營利事業及其關係企業間
兼職,兼職管制態樣(二)特別許可類-利益迴避、利益揭露,中研院知悉哪些人員應自行迴避而未迴避？,人事,https://www.sinica.edu.tw/ch/articles/332,中研院人事室,"依據中研院利益衝突迴避辦法規定，中研院研究人員及研究技術人員兼任公股代表或政府直接或間接投資事業之董事、監察人或相類似職務期間，應依公職人員利益衝突迴避法規定利益迴避。因此，中研院知悉應自行迴避而未迴避人員為：

1.中研院研究人員及研究技術人員兼任與中研院訂有科技移轉或資助研究契約之新創公司"
兼職,兼職管制態樣(二)特別許可類-學術回饋金,那問題來了！中研院收取學術回饋金的目的是什麼？全繳入科學研究基金嗎？,人事,https://www.sinica.edu.tw/ch/articles/332,中研院人事室,"根據中研院規定，收取學術回饋金的目的在於支應中研院研究人員及研究技術人員兼任新創公司或營利事業獨立董事或非執行經營業務職務的兼職費。這些兼職費是以中研院研究人員及研究技術人員實際領取的兼職費為計算基準，分別以百分之十五或百分之二十計算。

中研院收取學術回饋金後，會全額繳入科學研究基金，供作支應中研院各項研究"
兼職,兼職管制態樣(三)一般許可類,那你覺得，中研院的這項服務公告，對研究人員和研究技術人員的兼職管制有哪些影響嗎？他們需要注意哪些事項？,人事,https://www.sinica.edu.tw/ch/articles/332,中研院人事室,"根據中研院的這項服務公告，研究人員和研究技術人員的兼職管制有四項重點：

一、兼職不得影響本職工作：研究人員和研究技術人員的兼職不得影響本職工作，也就是說，他們在兼職期間仍需全心投入本職工作，不得有分心或怠忽職守的情形。

二、需經所屬研究所(處)、研究中心主管同意：研究人員和研究技術人員的兼職申請"
兼職,兼職管制態樣(四)報備類,那很好！根據提供的服務項目與服務說明，我提出以下問題：,人事,https://www.sinica.edu.tw/ch/articles/332,中研院人事室,"非常感謝你的問題！依據中研院的規定，研究人員兼職須經核准，否則將不予核准或應命停止兼職。因此，如果研究人員未獲核准兼職，或未依規定辦理兼職揭露，即屬違規情事。

舉例來說，如果研究人員兼任非營利事業或團體職務，未獲核准或未依規定辦理兼職揭露，即屬違規。又如研究人員兼任學術期刊、叢書、"
兼職,兼職管制態樣(四)報備類,問：中研院研究人員如果兼職，在哪些情況下不用申請同意及核准？,人事,https://www.sinica.edu.tw/ch/articles/332,中研院人事室,"根據中研院規定，研究人員如果兼職，在下列情形下不用申請同意及核准：

一、未兼任行政職務之研究人員，兼任非營利為目的之事業或團體職務，且未受有兼職費。但至私立學校兼任教研職務，應依規定經主管同意及中研院核准。

二、未兼任行政職務之研究人員，兼任學術期刊、叢書及教育部訂定之"
兼職,兼職管制態樣(四)報備類,（答案：依照規定辦理兼職揭露）,人事,https://www.sinica.edu.tw/ch/articles/332,中研院人事室,"依據中研院規定，研究人員兼職須經核准，否則將免申請同意及核准，或應命停止兼職。以下為可能情況：

（一）未兼任行政職務之研究人員，兼任非營利事業或團體職務，且未受兼職費。但至私立學校兼任教研職務，應經主管同意及中研院核准。

（二）未兼任行政職務之研究人員，兼任學術期刊"
兼職,兼職管制態樣(五)免除管制類,那你最近有沒有發現，中研院的員工好像可以兼差超多，而且不用報備就可以直接去兼差？！！！,人事,https://www.sinica.edu.tw/ch/articles/332,中研院人事室,根據中研院的規定，研究人員及研究技術人員兼職時，若無須申請核准或經核准後停止兼職，包括:(一)兼任政府機關(構)、公立學校、行政法人之任務編組職務或臨時性需要所設置之職務；(二)於工作時間以外，依個人才藝表現獲取適當報酬，並就其財產之處分、智慧財產權及肖像權之授權行使獲取合理對價
兼職,兼職管制態樣(五)免除管制類,喔，你知道嗎？原來中研院有公告特定情形下，研究人員兼職免申請同意及核准，而且還可以在工作時間以外，依才藝表現拿到報酬，甚至可以決定他們的財產、智慧財產權、肖像權怎麼運用！！！,人事,https://www.sinica.edu.tw/ch/articles/332,中研院人事室,"喔，啊！原來中研院有公告特定情形下，研究人員兼職免申請同意及核准，而且還可以在工作時間以外，依才藝表現拿到報酬，這真是太方便了！而且還可以決定他們的財產、智慧財產權、肖像權怎麼運用！這真是個好消息！

問題：那這下子，研究人員兼職就沒問題了！？

答案：不，不，不！這只是中研院公告的特定"
兼職,兼職管制態樣(五)免除管制類,疑？！中,人事,https://www.sinica.edu.tw/ch/articles/332,中研院人事室,"根據上述文字說明，研究人員及研究技術人員的兼職情形，若符合下列三種情況之一，即免申請同意及核准，並免依規定辦理兼職揭露：

一、研究人員兼任政府機關(構)、公立學校、行政法人之任務編組職務或臨時性需要所設置之職務。
二、研究人員及研究技術人員於工作時間以外，依其才藝表現，獲取適當報酬，並就其財產"
兼職,定義規範之兼職事項,"OK, here are some questions for you:",人事,https://www.sinica.edu.tw/ch/articles/332,中研院人事室,"OK, I'll answer your questions in a casual tone without using any auxiliary verbs.

Question 1: What is the Central Intelligence Agency?
Answer: The Central Intelligence Agency (CIA) is an intelligence agency of the United States government.

Question 2: What is the National Institutes of Health?
Answer: The National Institutes of Health (NIH) is a part of the United States Department of Health and Human Services"
兼職,定義規範之兼職事項,"What kind of research projects can be conducted under the ""definition-regulated part-time work"" service?",人事,https://www.sinica.edu.tw/ch/articles/332,中研院人事室,"根據日常說話語氣，可回答此問題如下：

研究項目可以被列為「定義規範部分工時工作」服務的類型，包括：

⋯⋯其他經中研院核准之研究項目。⋯⋯"
兼職,兼職消極條件,那你覺得，如果中研院的研究人員或研究技術人員，兼職時有下列哪一項情形，中研院應該不准他們兼職呢？,人事,https://www.sinica.edu.tw/ch/articles/332,中研院人事室,"根據日常說話的語氣，如果中研院的研究人員或研究技術人員兼職時有下列情形之一，中研院應該不准他們兼職：

一、與本職工作性質不相容：如果兼職與本職工作性質不相容，可能影響本職工作進度或品質，中研院就應該不准兼職。

二、對本職工作有不良影響之虞：如果兼職可能影響本職工作"
兼職,兼職消極條件,A.跟本職工作性質不相容。,人事,https://www.sinica.edu.tw/ch/articles/332,中研院人事室,"根據日常說話語氣，回答問題時，可使用「很明顯地」、「明顯地」、「明顯地」、「顯然地」、「明顯地」等詞語，來表達不予核准或停止兼職的理由。

例句：

A.很明顯地，與本職工作性質不相容。

B.明顯地，兼職與本職工作性質不相容。

C.明顯地"
兼職,兼職消極條件,B.對本職工作有不良影響之虞。,人事,https://www.sinica.edu.tw/ch/articles/332,中研院人事室,"根據日常說話語氣，回答問題時，避免使用語助詞，直接回答如下：

B.對本職工作有不良影響之虞。

理由：
中研院研究人員及研究技術人員兼職時，應審慎評估兼職對本職工作可能產生的不良影響，若兼職與本職工作性質不相容，或有不良影響之虞，應不予核准或於兼職期間廢止其核准，或"
兼職,兼職消極條件,C.有損中研院形象之虞。,人事,https://www.sinica.edu.tw/ch/articles/332,中研院人事室,"根據日常說話的語氣，回答此問題時，可使用「可能」、「可能有」、「有」、「有疑慮」等詞語。

例句：

*可能有損中研院形象之虞。
*可能有不良影響之虞。
*有疑慮有損中研院形象之虞。
*有損中研院形象之虞，應不予核准。
*有損中研院形象之虞，於"
兼職,兼職消極條件,D.有洩漏公務機密之虞。,人事,https://www.sinica.edu.tw/ch/articles/332,中研院人事室,"根據日常說話的語氣，並避免使用語助詞，回答問題時，可使用以下答案：

D.中研院研究人員及研究技術人員兼職時，如有洩漏公務機密之虞，應不予核准或於兼職期間廢止其核准，或命其停止兼職。"
兼職,兼職消極條件,E.有營私舞弊之虞。,人事,https://www.sinica.edu.tw/ch/articles/332,中研院人事室,"根據日常說話的語氣，回答問題時，避免使用語助詞，直接回答如下：
E.研究人員及研究技術人員有營私舞弊之虞。"
兼職,兼職消極條件,F.有職務,人事,https://www.sinica.edu.tw/ch/articles/332,中研院人事室,根據日常說話語氣，可回答為：「有職務上的疑慮。」
兼職,兼職時數及兼職費,那很好！根據提供的服務項目與服務說明，我提出以下問題：,人事,https://www.sinica.edu.tw/ch/articles/332,中研院人事室,非常感謝你的問題！依據中研院規定，研究人員及研究技術人員兼任新創公司董事、創辦新事業之發起人、營利事業獨立董事及非執行經營業務等職務，每週合計不得超過8小時。另依規定，研究人員(含院長、副院長、兼任主管人員)兼職費支給，不受軍公教人員兼職費支給表規定之限制。
兼職,兼職時數及兼職費,中研院研究人員及研究技術人員兼職時數及兼職費的計算方式為何？,人事,https://www.sinica.edu.tw/ch/articles/332,中研院人事室,"根據中研院規定，研究人員及研究技術人員兼職時數每週不得超過8小時，因此，若以每週工作5天計算，兼職時數為5×8=40小時。

兼職費部分，依規定研究人員(含院長、副院長、兼任主管人員)兼職費支給標準為新臺幣500元至1,500元，但兼職費個數及上限不受軍公教人員兼"
兼職,兼職時數及兼職費,中研院應如何定期公告中研院研究人員及研究技術人員兼任新創公司董事、創辦新事業之發起人、營利事業獨立董事及非執行經營業務等職務的兼職情形？,人事,https://www.sinica.edu.tw/ch/articles/332,中研院人事室,"根據中研院規定，中研院研究人員及研究技術人員兼任新創公司董事、創辦新事業之發起人、營利事業獨立董事及非執行經營業務等職務，每週兼職時數合計不得超過8小時。因此，中研院應定期公告中研院研究人員及研究技術人員兼任這些職務的兼職情形，以昭公信。

舉例來說，中研院可定期在網站上公告中研院研究人員及研究技術人員兼任新創"
兼職,兼職時數及兼職費,中研院研究人員(含院長、,人事,https://www.sinica.edu.tw/ch/articles/332,中研院人事室,依據上述文字說明，中研院研究人員(含院長、副院長、兼任主管人員)兼職費的支領數額及上限，不受軍公教人員兼職費支給表規定的限制。也就是說，中研院研究人員兼職費的支領數額及上限，可高於軍公教人員兼職費支給表規定的數額及上限。
兼職,到職揭露及年度揭露,好，以下是根據服務項目與服務說明，使用日常說話語氣提出的問題：,人事,https://www.sinica.edu.tw/ch/articles/332,中研院人事室,"好，依據文字說明，我將使用日常說話語氣回答問題。首先，請說明中研院研究人員及研究技術人員到職時應填寫「中央研究院人員到職前兼職揭露告知書」的原因。

答：中研院研究人員及研究技術人員到職時應填寫「中央研究院人員到職前兼職揭露告知書」，是因他們到職時已兼任職務，並經所屬研究所(處)、研究中心主管同意"
兼職,到職揭露及年度揭露,中研院研究人員及研究技術人員到職時，為什麼要填寫「中央研究院人員到職前兼職揭露告知書」？,人事,https://www.sinica.edu.tw/ch/articles/332,中研院人事室,"根據中研院規定，中研院研究人員及研究技術人員到職時，必須填寫「中央研究院人員到職前兼職揭露告知書」，這是為了揭露到職時已兼任職務之情形，並經所屬研究所(處)、研究中心主管同意及中研院核准。這是為了落實中研院對人員兼職管理的規定，避免人員利用職缺名義在外兼職，影響中研院研究品質及聲譽。

問題：中"
兼職,到職揭露及年度揭露,為什麼中研院要求各單位於每年7月底前，彙整所屬人員填列的「中央研究院研究人員及研究技術人員兼職揭露表」送院備查？,人事,https://www.sinica.edu.tw/ch/articles/332,中研院人事室,根據中研院的規定，各單位應於每年7月底前彙整所屬人員填列的「中央研究院研究人員及研究技術人員兼職揭露表」送院備查，主要是為了解各人員的兼職情形，並作為是否同意繼續兼職的依據。中研院要求各單位每年檢討評估所屬研究人員及研究技術人員的兼職情形，是希望確保中研院人員的兼職符合科技移轉或科學研究的需要，並避免利益
兼職,到職揭露及年度揭露,為什麼中,人事,https://www.sinica.edu.tw/ch/articles/332,中研院人事室,根據上述文字說明，中研院研究人員及研究技術人員到職時應填寫「中央研究院人員到職前兼職揭露告知書」，揭露到職時已兼任職務之情形，並經所屬研究所(處)、研究中心主管同意及中研院核准。未經核准者，應立即停止兼職。各單位應於每年7月底前彙整所屬人員填列之「中央研究院研究人員及研究技術人員兼職揭露表」送院備
