category,title,question,group,url,contact,answer
研究技術人員聘審案件之救濟管道,研究技術人員聘任未通過之救濟管道,喔，那我有很多問題想問！例如：,人事,https://www.sinica.edu.tw/ch/articles/477,中研院人事室,"好！請就你所提出的問題一一回答。

問題1：新聘案未獲研究技術人員聘審會表決通過者，提案單位得向研究技術人員聘審會申請再議一次，這是否意味著提案單位有第二次機會可以證明自己的立場？

答：對。依據中央研究院研究技術人員聘審作業要點第12點規定，新聘案未獲研究技術人員聘審會表決通過者，"
研究技術人員聘審案件之救濟管道,研究技術人員聘任未通過之救濟管道,問題如果研究技術人員的聘任未通過，還能有哪些救濟管道嗎？（？）,人事,https://www.sinica.edu.tw/ch/articles/477,中研院人事室,根據上述文字說明，如果研究技術人員的聘任未通過，可向研究技術人員聘審會申請再議一次。此外，如果研究技術人員的續聘或升等案未獲研究所或研究中心審議通過，可向研究技術人員聘審會提出申訴。如果研究技術人員升等案未獲研究技術人員聘審會審議通過，可向院長提出申訴，由院長指派副院長成立申訴委員會處理。
研究技術人員聘審案件之救濟管道,研究技術人員聘任未通過之救濟管道,問題如果研究技術人員的續聘或升等案遭所(處)、中心審議不通過，還能向誰提出申訴？（？）,人事,https://www.sinica.edu.tw/ch/articles/477,中研院人事室,"根據中央研究院研究技術人員聘審作業要點第12點及第20點規定，如果研究技術人員的續聘或升等案遭所(處)、中心審議不通過，可向院長提出申訴。因此，可向院長申訴的人員包括：

1. 研究技術人員本人：可直接向院長提出申訴。
2. 所屬單位主管：可代表研究技術人員向院長提出申訴。"
研究技術人員聘審案件之救濟管道,研究技術人員聘任未通過之救濟管道,問題根據中央研究院的研究技術人員聘審作業要點第12點和第20點,人事,https://www.sinica.edu.tw/ch/articles/477,中研院人事室,根據中央研究院的研究技術人員聘審作業要點第12點和第20點，新聘案未獲研究技術人員聘審會表決通過者，提案單位得向研究技術人員聘審會申請再議一次。研究技術人員續聘或升等案經研究所(處)、研究中心審議不通過者，受評審人得向本院研究技術人員聘審會提出申訴。研究技術人員升等案經研究技術
研究人員及研究技術人員,薪資待遇,喔！那麼，研究人員年薪包含的月薪及獎金，會不會一共要繳很多稅？需要擔心被扣公保、退撫基金、健保、房租津貼嗎？,人事,https://www.sinica.edu.tw/ch/articles/478,中研院人事室,不，研究人員年薪包含月薪及獎金，但其中月薪的部分會扣繳公保、退撫基金、健保、房租津貼，但獎金部分則不扣繳這些項目。此外，研究人員若擔任主管職務，會另支領主管職務加給。
研究人員及研究技術人員,薪資待遇,特聘研究員還有研究獎助費，這筆錢可以拿去哪裡？,人事,https://www.sinica.edu.tw/ch/articles/478,中研院人事室,"根據文字說明，特聘研究員除了本薪(年功薪)外，另支有研究獎助費。這筆錢可以拿去哪裡？答案是：

1.學術研究獎金：特聘研究員可獲得學術研究獎金，但金額不定。
2.年終工作獎金：特聘研究員也可獲得年終工作獎金，但金額不定。
3.研究技師技術獎助費：特聘研究員"
研究人員及研究技術人員,薪資待遇,研究技師技術獎助費又是什麼？會不會也有很多支出？,人事,https://www.sinica.edu.tw/ch/articles/478,中研院人事室,"研究技師技術獎助費是補助研究技師從事研究工作的費用，包括實驗材料費、儀器設備費、交通費、住宿費、出國差旅費等。這些費用會因人而異，無法提供具體數額。

舉例來說，實驗材料費可能包含購買試劑、試藥、樣品、儀器零件等；儀器設備費可能包含購買或租用精密儀器、設備、儀控系統等；交通費可能包含"
研究人員及研究技術人員,薪資待遇,如果擔任主管職務，還會有主管職務加給？需要,人事,https://www.sinica.edu.tw/ch/articles/478,中研院人事室,根據上述文字說明，如果擔任主管職務，則另依兼任主管職稱支主管職務加給。
研究人員及研究技術人員,保險,好，以下是根據服務項目與服務說明提出的問題：,人事,https://www.sinica.edu.tw/ch/articles/478,中研院人事室,"好，根據上述文字說明，我將回答你的問題。首先，研究人員及研究技術人員的保險包含公教人員保險及全民健康保險。公教人員保險由中央研究院人事室辦理加保、退保，而全民健康保險則由中央研究院人事室辦理加保、退保。

公教人員保險得申請給付項目包含失能給付、養老給付、死亡給付、眷屬喪葬津貼、生育給"
研究人員及研究技術人員,保險,研究人員及研究技術人員的保險，包括公教人員保險及全民健康保險，為什麼要包含這兩種保險？,人事,https://www.sinica.edu.tw/ch/articles/478,中研院人事室,"研究人員及研究技術人員的保險包含公教人員保險及全民健康保險，主要是因為這兩個保險都是為保障研究人員及研究技術人員的基本權益而設。公教人員保險是依據公教人員保險法的規定辦理加保、退保，而全民健康保險則是依據全民健康保險法的規定辦理加保、退保。

公教人員保險的主要給付項目包括失能給付、養老給付、死亡給付、眷屬喪葬"
研究人員及研究技術人員,保險,公教人員保險是由中央研究院人事室辦理加保、退保，為什麼是這個單位負責？,人事,https://www.sinica.edu.tw/ch/articles/478,中研院人事室,根據文字說明，公教人員保險是由中央研究院人事室辦理加保、退保。
研究人員及研究技術人員,保險,公教人員保險給付項目包含失能給付、養老給付、死亡給付、眷屬喪葬津,人事,https://www.sinica.edu.tw/ch/articles/478,中研院人事室,"根據日常說話語氣，並避免使用語助詞，回答問題如下：

公教人員保險給付項目包含失能給付、養老給付、死亡給付、眷屬喪葬津貼。

全民健康保險提供日常就醫、急診等綜合性醫療服務。"
約聘僱人員,薪資待遇,喔，那你知道中央研究院的約聘僱人員年薪包含哪些部分嗎？是月薪和哪些獎金？還有，他們的年終工作獎金怎麼計算的呢？這些問題都超級好奇啊！（笑）,人事,https://www.sinica.edu.tw/ch/articles/473,中研院人事室,"好啦！中央研究院的約聘僱人員年薪包含月薪和獎金兩大部分。月薪部分包含本薪、勞工保險、勞工退休金自行提撥、健保等四項扣繳項目。獎金部分則包含年終工作獎金。

年終工作獎金的計算方式為：年終工作獎金為本薪的0.5個月。

舉例來說，如果一位中央研究院的約聘僱人員月薪為新台幣3萬元，"
約聘僱人員,保險,好，以下是根據服務項目與服務說明提出的問題：,人事,https://www.sinica.edu.tw/ch/articles/473,中研院人事室,"好，我根據日常說話語氣和避免使用語助詞的原則，回答您的問題如下：

約聘僱人員的保險包含勞工保險和全民健康保險。約聘僱人員到職後和離職時，依據勞工保險條例和勞工保險施行細則辦理加保和退保業務。勞工保險的類別和給付種類包含普通事故保險的生育、傷病、失能、老年和死亡5種給付。就業保險"
約聘僱人員,保險,請問保險的種類有哪些？(疑),人事,https://www.sinica.edu.tw/ch/articles/473,中研院人事室,"約聘僱人員之保險包含勞工保險及全民健康保險。

勞工保險之分類及其給付種類包含普通事故保險：分生育、傷病、失能、老年及死亡5種給付。

就業保險：分育嬰留職停薪津貼、失業2種給付。

職業災害保險：分傷病、醫療、失能及死亡4種給付。

全民健康保險於人員到職後及"
約聘僱人員,保險,約聘僱人員在什麼情況下需要辦理加保、退保？(疑),人事,https://www.sinica.edu.tw/ch/articles/473,中研院人事室,"根據文字說明，約聘僱人員在下列情況下需要辦理加保、退保：

1. 到職後：約聘僱人員到職後，依勞工保險條例及其施行細則規定，辦理加保業務。
2. 離職時：約聘僱人員離職時，依勞工保險條例及其施行細則規定，辦理退保業務。
3. 就業保險：約聘僱人員到職後及離"
約聘僱人員,保險,勞工保險的給付種類有哪些？(疑),人事,https://www.sinica.edu.tw/ch/articles/473,中研院人事室,根據文字說明，勞工保險的給付種類包含普通事故保險的生育、傷病、失能、老年及死亡5種給付。
約聘僱人員,保險,就業保險的給付種類有哪些？(疑),人事,https://www.sinica.edu.tw/ch/articles/473,中研院人事室,根據文字說明，就業保險給付種類為「育嬰留職停薪津貼」及「失業給付」。
約聘僱人員,保險,職業災害保險的給付種類有哪些？(疑),人事,https://www.sinica.edu.tw/ch/articles/473,中研院人事室,根據文字說明，職業災害保險的給付種類有四種：傷病、醫療、失能、死亡。
