category,title,question,group,url,contact,answer
兼職,兼職違反規定之處理,那你需要針對中研院的兼職違反規定之處理提出問題，以下是幾項與日常相關的問題：,人事,https://www.sinica.edu.tw/ch/articles/332,中研院人事室,"好, 我根據日常說話語氣和避免使用語助詞的原則, 回答你的問題如下：

問題：中研院研究人員及研究技術人員違反兼職規定者，應移送中研院學組級倫理委員會依中研院各級倫理委員會設置及作業要點審議。

答：依據中研院各級倫理委員會設置及作業要點，違反兼職規定的中研院研究人員及研究技術人員，應移送學組級倫理"
兼職,兼職違反規定之處理,你最近有沒有發現身邊很多人都在找兼職？為什麼？,人事,https://www.sinica.edu.tw/ch/articles/332,中研院人事室,嗯……有啊……最近有啊……因為我們中研院的同事們很認真工作啊……他們很認真地在做研究啊……所以他們很忙啊……所以他們很難找兼職啊……他們真的沒空啊……所以他們沒有兼職啊……他們真的沒空啊……所以他們沒有兼職啊……他們真的沒空啊……所以他們沒有兼職啊……他們真的沒空
兼職,兼職違反規定之處理,你知道中研院有規定不能兼職嗎？為什麼？,人事,https://www.sinica.edu.tw/ch/articles/332,中研院人事室,嗯，根據中研院的規定，研究人員及研究技術人員不能兼職，主要是為了避免利益衝突和保密問題。中研院各級倫理委員會會依中研院各級倫理委員會設置及作業要點審議違反兼職規定者。
兼職,兼職違反規定之處理,你身邊有朋友因為兼職被罰過嗎？是什麼情形？,人事,https://www.sinica.edu.tw/ch/articles/332,中研院人事室,"嗯……有啊。朋友曾因兼職違反中研院的規定,被移送院內倫理委員會審議。"
兼職,兼職違反規定之處理,你覺得為什麼中研院要設立兼職違反規定之處理？有什麼原因？,人事,https://www.sinica.edu.tw/ch/articles/332,中研院人事室,根據日常說話語氣，我感覺這問題應該是問著為什麼中研院要設立兼職違反規定之處理，而不是問著什麼原因。因此，我回答說：「因為中研院要處理違反兼職規定的事情啊！」
兼課,兼課,"OK, no problem! Here are some questions for you:",人事,https://www.sinica.edu.tw/ch/articles/331,中研院人事室,"OK, no problem! Here are some questions for you:

1. How do you feel about the new policy?

2. What do you think about the number of hours allowed for teaching per week?

3. Do you think the policy will affect your workload?

4. How do you think the policy will impact the productivity of the institute?

5. Do you have any suggestions for improving the policy?"
兼課,兼課,"If a researcher at the Academia Sinica has a part-time job as a teacher at a university, how many hours can they spend on teaching per week, including their main job and any part-time jobs? (4 hours is the limit, according to the service description.)",人事,https://www.sinica.edu.tw/ch/articles/331,中研院人事室,"根據日常說話語氣，本問題可回答如下：

依據文字說明，研究人員及研究技術人員在不影響本職工作下至學校授課，每週授課時數包含合聘授課時數合計不得超過4小時。換言之，研究人員及研究技術人員每週最多可授課4小時。"
兼課,兼課,喔！那麼，中研院的研究人員和研究技術人員去學校兼課，是不是要先跟中研院報備，然後再由學校核發公文給中研院？他們去上課的時候，是不是不用填假單，直接用核准的公文就好？是這樣嗎？（？）,人事,https://www.sinica.edu.tw/ch/articles/331,中研院人事室,喔！不，那不是這樣！根據文字說明，中研院各研究所(處)、中心應於每學期開學後2週內彙整所屬研究人員及研究技術人員於各校授課時數及授課時間表，經各研究所(處)、中心所長、主任同意，報院備查。這代表著中研院研究人員及研究技術人員去學校兼課之前，必須先取得中研院的同意，並由中研院
請假,請假規定,那你知道中研院的請假規定有多嚴格嗎？,人事,https://hro.sinica.edu.tw/pdfjs/full?file=/archives/a0f8f441a677b761#zoom=115&pagemode=thumbs,中研院人事室,"依據中研院的規定，研究人員及研究技術人員請假的規定如下：

1. 事假：每年7日，可扣薪，但超過7日者，以日扣薪。
2. 家庭照顧假：每年7日，可扣薪，但超過7日者，以日扣薪。
3. 病假：每年28日，可扣薪，但超過28日者，以日扣薪。"
請假,請假規定,中研院的請假天數有哪些限制？,人事,https://hro.sinica.edu.tw/pdfjs/full?file=/archives/a0f8f441a677b761#zoom=115&pagemode=thumbs,中研院人事室,"依據中研院規定，請假天數有以下限制：

1. 事假：每學年7日，超過7日者，按日扣薪。
2. 家庭照顧假：每學年7日，超過7日者，不計入事假計算。
3. 病假：每學年28日，超過28日者，以事假抵銷。
4. 家庭照顧假：每學"
請假,請假規定,為什麼女性研究人員及研究技術人員可以有更多生理假？,人事,https://hro.sinica.edu.tw/pdfjs/full?file=/archives/a0f8f441a677b761#zoom=115&pagemode=thumbs,中研院人事室,根據中研院規定，女性研究人員及研究技術人員因生理日致工作有困難者，每月得請生理假1日，全學年請假日數未逾3日，不併入病假計算，其餘日數併入病假計算。因此，女性研究人員及研究技術人員可請生理假1日，最多可有3日。
請假,請假規定,為什麼有人可以有長達1年的產前假和產後假？,人事,https://hro.sinica.edu.tw/pdfjs/full?file=/archives/a0f8f441a677b761#zoom=115&pagemode=thumbs,中研院人事室,依據中研院規定，女性研究人員及研究技術人員因生理日致工作有困難者，每月得請生理假1日，全學年請假日數未逾3日，不併入病假計算，其餘日數併入病假計算。因此，女性研究人員及研究技術人員最多可有3日生理假。而女性研究人員及研究技術人員於分娩前，給產前假8日，得分次申請，不得保留至分
請假,請假規定,如果父母、配偶或親人過世，可以請多少天喪假？,人事,https://hro.sinica.edu.tw/pdfjs/full?file=/archives/a0f8f441a677b761#zoom=115&pagemode=thumbs,中研院人事室,依據中研院規定，如果父母、配偶或親人過世，可以請喪假15日。
請假,請假規定,為什麼捐贈骨髓或器官者可以有彈性,人事,https://hro.sinica.edu.tw/pdfjs/full?file=/archives/a0f8f441a677b761#zoom=115&pagemode=thumbs,中研院人事室,根據中研院規定，捐贈骨髓或器官者，視實際需要給請假日數，因此可彈性調整請假天數。
請假,請假規定,好，以下是根據「請假規定」的服務項目與服務說明，提出以問號為結尾的問題：,人事,https://hro.sinica.edu.tw/pdfjs/full?file=/archives/a0f8f441a677b761#zoom=115&pagemode=thumbs,中研院人事室,"好，依據「請假規定」的內容，我提出的問題如下：

問：中研院研究人員及研究技術人員有哪些情況可以請公假？

答：依據「請假規定」，中研院研究人員及研究技術人員可以請公假的情事有七種，分別是：

一、依法受各種兵役召集。

二、參加政府依法主辦之各項投票。

三、因執行研究工作或上下班"
請假,請假規定,問題：中研院研究人員及研究技術人員如果遇到哪種情況，可以請公假？（？）,人事,https://hro.sinica.edu.tw/pdfjs/full?file=/archives/a0f8f441a677b761#zoom=115&pagemode=thumbs,中研院人事室,"根據上述文字說明，中研院研究人員及研究技術人員可以請公假的情事包括：

1.依法受各種兵役召集。
2.參加政府依法主辦之各項投票。
3.因執行研究工作或上下班途中發生危險以致傷病，必須休養或療治，其期間在2年以內。
4.應國內外機關團體或學校邀請，參加與其研究工作有關之各項會議、活動或演講，"
請假,請假規定,"OK, here are some questions that end with a question mark:",人事,https://hro.sinica.edu.tw/pdfjs/full?file=/archives/a0f8f441a677b761#zoom=115&pagemode=thumbs,中研院人事室,"Sure, here are some answers in a conversational tone:

Question: Can you explain the meaning of ""留職停薪"" in the context of this article?
Answer: Sure! In this article, ""留職停薪"" refers to an employee who is granted leave of absence for a period of time, during which they continue to hold their job and receive a portion of their salary.
Question: How long can an employee be granted leave of absence for a period"
請假,請假規定,Service item: {Request for leave},人事,https://hro.sinica.edu.tw/pdfjs/full?file=/archives/a0f8f441a677b761#zoom=115&pagemode=thumbs,中研院人事室,"請假已滿2年合併計算不得超過1年之延長期限或請公假已滿2年之期限，仍不能銷假者，應予留職停薪或依法辦理退休或資遣。

延長病假或因公傷病假自留職停薪之日起已逾1年仍未痊癒者，應依法辦理退休或資遣。但其留職停薪係因執行研究工作且情況特殊者，得"
請假,請假規定,"Service explanation: ""{If the leave is for sickness or injury, the leave period must be counted in the year period, and the leave period must not exceed 1 year. If the leave is for other reasons, the leave period must be counted separately from the 2-year period. If the leave period exceeds 1 year, the employee",人事,https://hro.sinica.edu.tw/pdfjs/full?file=/archives/a0f8f441a677b761#zoom=115&pagemode=thumbs,中研院人事室,"依據上述文字說明，日常說話語氣為「請」、「病假」、「公假」、「留職停薪」、「退休」、「資遣」等詞語。

問：請假天數已達1年仍未痊癒，應辦理退休或資遣，但留職停薪係因執行研究工作且情況特殊者，得由中研院審酌延長，其延長以1年為限。請"
請假,請假規定,喔！那麼，如果中研院的研究人員或研究技術人員，因為生病而辦了留職停薪，而且在留職停薪期間真的好了，那他們可以向中研院申請復職嗎？需要提供什麼文件嗎？,人事,https://hro.sinica.edu.tw/pdfjs/full?file=/archives/a0f8f441a677b761#zoom=115&pagemode=thumbs,中研院人事室,好啦！依據文字說明，如果中研院的研究人員或研究技術人員因為生病而辦了留職停薪，在留職停薪期間真的好了，他們可以向中研院申請復職。他們不需要提供病癒證明書，就可以直接向中研院申請復職，並以復職當日為退休或資遣生效日。
請假,請假規定,等等……，問題來了！如果他們在留職停薪期間是為了辦理退休或資遣而辦了留職停薪，而且在留職停薪期間真的好了，那他們可以不用附上病癒證明,人事,https://hro.sinica.edu.tw/pdfjs/full?file=/archives/a0f8f441a677b761#zoom=115&pagemode=thumbs,中研院人事室,正確！依據文字說明，如果中研院研究人員及研究技術人員在留職停薪期間辦理退休或資遣，且於留職停薪期間已痊癒，則無須附上病癒證明書即可向中研院申請復職，並以復職當日為退休或資遣生效日。
請假,請假規定,好問題！根據服務項目和服務說明，我有以下問題要問：,人事,https://hro.sinica.edu.tw/pdfjs/full?file=/archives/a0f8f441a677b761#zoom=115&pagemode=thumbs,中研院人事室,好啦！根據中研院的規定，研究人員及研究技術人員每學年應給休假21日，並得以時計。休假日數若未於當年度休畢，可保留至次學年實施，但不支給不休假加班費。初任人員於9月以後到職者，得按當月至學年終之在職月數比例核給休假；任職未滿1學年者，依在
請假,請假規定,問：中研院研究人員及研究技術人員，每學年可以休假多少天？（A）天，（B）30天，（B）40天，（C）50天，（D）60天。,人事,https://hro.sinica.edu.tw/pdfjs/full?file=/archives/a0f8f441a677b761#zoom=115&pagemode=thumbs,中研院人事室,"根據日常說話語氣，可回答此問題如下：

問：中研院研究人員及研究技術人員每學年可以休假多少天？我估計大概是（A）天。"
請假,請假規定,答案：（A）天。,人事,https://hro.sinica.edu.tw/pdfjs/full?file=/archives/a0f8f441a677b761#zoom=115&pagemode=thumbs,中研院人事室,"依據文字說明，本問題答案為（A）天。

理由：

根據文字說明，中研院研究人員及研究技術人員每學年應給休假21日，並得以時計。休假未休畢之日數，得保留至次學年實施，不支給不休假加班費；次學年仍未休畢，視為放棄。因此，初任人員於9月以後到職者，得按當"
請假,休假講學研究規定,好，以下是根據提供的內容提出的問題：,人事,https://hro.sinica.edu.tw/pdfjs/full?file=/archives/a0f8f441a677b761#zoom=115&pagemode=thumbs,中研院人事室,好，根據文字說明，我將回答你的問題。依據文字說明，中研院特聘研究員及研究員符合一定條件者，得申請休假從事講學研究工作，期間支領全薪，但延長服務期間不得申請。申請休假從事講學研究工作人員，各研究所(處)、研究中心每年不得超過該所(處)、中心特聘研究員及研究員人數10分之1，其不足10人者
請假,休假講學研究規定,問：如果中研院特聘研究員及研究員同時符合「每連續服務滿6個月以上」及「每連續服務滿7年以上」的兩項條件，可以申請休假從事講學研究工作多久？,人事,https://hro.sinica.edu.tw/pdfjs/full?file=/archives/a0f8f441a677b761#zoom=115&pagemode=thumbs,中研院人事室,根據中研院規定，如果中研院特聘研究員及研究員同時符合「每連續服務滿6個月以上」及「每連續服務滿7年以上」的兩項條件，可以申請休假從事講學研究工作半年。因此，如果中研院特聘研究員及研究員同時符合上述兩項條件，就可以申請休假從事講學研究工作半年。
請假,休假講學研究規定,※注：答案應該是「可申請休假從事講學研究工作」。,人事,https://hro.sinica.edu.tw/pdfjs/full?file=/archives/a0f8f441a677b761#zoom=115&pagemode=thumbs,中研院人事室,依據上述文字說明，中研院特聘研究員及研究員符合一定條件者，得申請休假從事講學研究工作，期間支領全薪，但延長服務期間不得申請。申請休假從事講學研究工作人員，各研究所(處)、研究中心每年不得超過該所(處)、中心特聘研究員及研究員人數10分之1，其不足10人者，由各研究所(處)、研究中心報請
請假,休假講學研究規定,好，以下是根據「休假講學研究規定」和「服務說明」，提出以問號為結尾的問題：,人事,https://hro.sinica.edu.tw/pdfjs/full?file=/archives/a0f8f441a677b761#zoom=115&pagemode=thumbs,中研院人事室,"好！根據「休假講學研究規定」和「服務說明」，我提出的問題如下：

1. 中研院特聘研究員及研究員休假從事講學研究工作期滿後，應即返院繼續服務，服務期間為休假從事講學研究工作期間之2倍。
2. 休假從事講學研究工作期滿應提出講學研究報告，經所屬單位依內部審查機制，確認研究"
請假,休假講學研究規定,中研院特聘研究員及研究員休假期間，如果未依規定服務，會發生什麼情況？,人事,https://hro.sinica.edu.tw/pdfjs/full?file=/archives/a0f8f441a677b761#zoom=115&pagemode=thumbs,中研院人事室,根據中研院的規定，特聘研究員及研究員休假期間，如果未依規定服務，將會被要求返院繼續服務，並須提出講學研究報告，經所屬單位審查後函報院方備查。如果未能履行服務義務，不得再申請休假從事講學研究工作。
請假,休假講學研究規定,？？？,人事,https://hro.sinica.edu.tw/pdfjs/full?file=/archives/a0f8f441a677b761#zoom=115&pagemode=thumbs,中研院人事室,根據上述文字說明，研究員休假期間從事講學研究工作期間為2倍，期滿後應提出講學研究報告，經所屬單位內部審查機制確認後函報院方備查。因此，研究員休假期間從事講學研究工作期間為2倍，期滿後應提出報告，並經所屬單位內部審查機制確認後函報院方備查。
請假,請假規定,好，那我們來玩一個小遊戲！根據「請假規定」這個服務項目和服務說明，我提出幾個問題，全部都是以問號為結尾，等著你來解答！,人事,https://hro.sinica.edu.tw/pdfjs/full?file=/archives/a0f8f441a677b761#zoom=115&pagemode=thumbs,中研院人事室,"好！我看你的問題都是針對中研院的請假規定而來，我將回答你以日常說話語氣回答。

問：中研院研究人員及研究技術人員的請假，由各研究所（處）、研究中心主管自行核定？

答：對！根據中研院的請假規定，研究人員及研究技術人員的請假，由各研究所（處）、研究中心主管自行核定，並於30日內報院核准。"
請假,請假規定,問題如果中研院研究人員或研究技術人員要請30天內的假，應該由誰核定？？？,人事,https://hro.sinica.edu.tw/pdfjs/full?file=/archives/a0f8f441a677b761#zoom=115&pagemode=thumbs,中研院人事室,根據日常說話語氣，這個問題應該由「中研院院長」核定。因此，答案是「院長」。
請假,請假規定,問題如果超過30天的假，需要經誰核可？？？,人事,https://hro.sinica.edu.tw/pdfjs/full?file=/archives/a0f8f441a677b761#zoom=115&pagemode=thumbs,中研院人事室,根據日常說話語氣，這個問題可以回答為：「如果請假超過30天，就需要經院長核可。」
請假,請假規定,問題如果沒辦理,人事,https://hro.sinica.edu.tw/pdfjs/full?file=/archives/a0f8f441a677b761#zoom=115&pagemode=thumbs,中研院人事室,根據日常說話語氣，如果問題「如果沒辦理」，可能回答「沒辦」或「沒辦到」。避免使用語助詞，可直接回答「沒辦」或「沒辦到」。
請假,請假規定,好！那我來提出一些問題來測試你的語感！,人事,https://hro.sinica.edu.tw/pdfjs/full?file=/archives/a0f8f441a677b761#zoom=115&pagemode=thumbs,中研院人事室,"好！請回答問題。

問題：請假時數扣除例假日嗎？

答案：扣除。

問題：因公傷病請公假或因病延長假期是否扣除例假日？

答案：扣除。

問題：請假者請假時數以8小時計嗎？

答案：是。"
請假,請假規定,中研院的工友如果今天是週五，明天要休假日，但明天還要開會，可以請多少天假？（用日常語氣發問）,人事,https://hro.sinica.edu.tw/pdfjs/full?file=/archives/a0f8f441a677b761#zoom=115&pagemode=thumbs,中研院人事室,根據中研院研究人員及研究技術人員請假要點第3點規定，如果中研院工友今天是週五，明天要休假，但明天還要開會，可以請假的日數為8小時。因此，工友可以請假1日。
研究人員聘審規定,研究人員之新聘、續聘、升等相關規定,那很好！根據你提供的資訊，我提出了一些問題：,人事,https://www.sinica.edu.tw/ch/articles/477,中研院人事室,"很樂意回答你的問題！依據中央研究院研究所組織規程第10條、第9條、第8條、第7條的規定，研究員、副研究員、副研究員、助研究員的聘任資格為：

研究員：

* 任中央研究院研究員至少一年，成績優異並有傑出貢獻，獲國內外學術界認許者。
* 在公立大學或教育部立案之私立"
研究人員聘審規定,研究人員之新聘、續聘、升等相關規定,什麼樣的人在擔任教授職務期間，可以被認定有「學術上有重要貢獻及傑出成就」？,人事,https://www.sinica.edu.tw/ch/articles/477,中研院人事室,"根據中央研究院研究所組織規程第10條第1項第3款規定，「學術上有重要貢獻及傑出成就」的認定，應由中央研究院評議會透過公開、公正、公平的程序辦理。具體而言，可由下列方式認定：

1. 獲國內外學術界認許：包括獲得國內外學術界重要獎項、榮譽、或肯定，或獲聘任為國內外學術團體或機構的會員、顧問、或領導"
研究人員聘審規定,研究人員之新聘、續聘、升等相關規定,什麼樣的人在擔任研究助理期間，可以被認定有「相關學門之大學或獨立學院畢業」？,人事,https://www.sinica.edu.tw/ch/articles/477,中研院人事室,依據中央研究院研究所組織規程第10條第1項第3款規定，研究助理須「相關學門之大學或獨立學院畢業」。因此，如果個人未具博士學位，但曾就讀相關學門之大學或獨立學院，且已畢業，則符合資格。
研究人員聘審規定,研究人員之新聘、續聘、升等相關規定,什麼樣的人在獲得博士學位後，可以在中央研究院擔任「助理教授」職務？,人事,https://www.sinica.edu.tw/ch/articles/477,中研院人事室,根據中央研究院研究所組織規程第8條第2款規定，獲得博士學位後，可在中央研究院擔任「助理教授」職務的是「副研究員」。
研究人員聘審規定,研究人員之新聘、續聘、升等相關規定,什麼樣的人在擔任副教授期間，可以,人事,https://www.sinica.edu.tw/ch/articles/477,中研院人事室,"根據中央研究院研究所組織規程第10條第2項規定，副教授須符合下列條件之一：

1. 任中央研究院副研究員至少一年，在學術上有重要貢獻者。
2. 任公立大學或教育部立案之私立大學或獨立學院副教授，或任中央研究院認可之國外大學或獨立學院副教授，並從事研究工作，確有重要貢獻者。
3. 任中央"
研究技術人員聘審規定,研究技術人員之新聘、續聘、升等相關規定,喔！那你知道中央研究院的「研究技術人員」聘任，有哪些資格條件嗎？像是博士或碩士畢業，或是有相關研究經驗等等。,人事,https://www.sinica.edu.tw/ch/articles/477,中研院人事室,"依據中央研究院研究技術人員聘審作業要點第3點規定，研究副技師及研究助技師的聘任資格為：

研究副技師：

*具有博士學位或同等學歷證書，曾從事與所習學科有關之研究工作、專門職業或職務八年以上，並有與擬任職務性質相當之專門著作或技術性報告(含技術成品)或專業服務經歷者。
*曾任"
研究技術人員聘審規定,研究技術人員之新聘、續聘、升等相關規定,啊，對了！我還聽到說，他們的聘任資格還要看「研究副技師」、「研究助技師」、「技術助理」的資格，而且還有相關規定可以參考喔！（疑？）,人事,https://www.sinica.edu.tw/ch/articles/477,中研院人事室,研究副技師、研究助技師、技術助理的聘任資格，依據中央研究院研究技術人員聘審作業要點第3點規定，分別為博士學位或同等學歷證書、碩士學位或同等學歷證書、學士學位或同等學歷證書。此外，相關規定也規定，曾任研究副技師、研究助技師、技術助理四年以上，成績優良者，亦符合聘任資格。
研究人員及聘審案件之救濟管道,研究人員聘任未通過之救濟管道,好，以下是根據服務項目與服務說明，使用日常說話語氣，提出的問號為結尾的問題：,人事,https://www.sinica.edu.tw/ch/articles/477,中研院人事室,"好！根據上述文字說明，如果新聘案或升等案未獲學組聘審會或研究所、研究中心通過，提案單位或受評審人可在一個月內向院聘審會或所屬學組提出再議或申訴。逾期未申訴者，原決議即為確定。

如果升等或長聘案未獲研究所或研究中心通過，受評審人可在一個月內向所屬學組聘審會提出申訴。"
研究人員及聘審案件之救濟管道,研究人員聘任未通過之救濟管道,問題如果研究人員在新聘未通過的救濟管道中，提案單位在接獲通知後的一個月內，未向院聘審會申請再議，是否會直接確定續聘、升等或長聘的決定？,人事,https://www.sinica.edu.tw/ch/articles/477,中研院人事室,"根據上述文字說明,如果研究人員在新聘未獲通過的救濟管道中,提案人未於接獲通知後的一個月內向院聘審會申請再議,則其續聘、升等或長聘的決定將直接確定。"
研究人員及聘審案件之救濟管道,研究人員聘任未通過之救濟管道,問題如果續聘、升等或長聘（包括新聘同時辦的長聘）,人事,https://www.sinica.edu.tw/ch/articles/477,中研院人事室,"如果續聘、升等或長聘（包括新聘同時辦的長聘）案未獲學組聘審會審查通過，受評審人自接獲通知之次日起一個月內，得向所屬學組聘審會提出申訴。逾期未申訴者，續聘、升等或長聘的決定即為確定。

如果升等或長聘（包括新聘同時辦的長聘）案經研究所（處）、研究中心"
